workbook_record_id,year,title,author_list,venue,engine,citation_count,h5_index,mean_citation,quartile,quality_signal_available,screening_status,source_sheet
5,2023,adversarial machine learning attacks against intrusion detection systems: a survey on strategies and defense,"['a alotaibi', 'ma rassam']",future internet,google,91,,45.5,Q2,quartile,excluded,excluded
19,2024,flowgananomaly: flow-based anomaly network intrusion detection with adversarial learning,"['z li', 'p wang', 'z wang']",chinese journal of electronics,google,39,,39,Q3,quartile,excluded,excluded
20,2022,adaptative perturbation patterns: realistic adversarial learning for robust intrusion detection,"['j vitorino', 'n oliveira', 'i praça']",future internet,google,36,,12,Q2,quartile,excluded,excluded
38,2022,a comparative study on the impact of adversarial machine learning attacks on contemporary intrusion detection datasets,"['m pujari', 'y pacheco', 'b cherukuri', 'w sun']",sn computer science,google,12,,4,Q2,quartile,excluded,excluded
45,2024,pre-trained language model-enhanced conditional generative adversarial networks for intrusion detection,"['f li', 'h shen', 'j mai', 't wang', 'y dai', 'x miao']",peer-to-peer networking and applications,google,19,,19,Q2,quartile,excluded,excluded
50,2023,on the robustness of ml-based network intrusion detection systems: an adversarial and distribution shift perspective,"['m wang', 'n yang', 'dh gunasinghe', 'n weng']",computers,google,8,,4,Q2,quartile,excluded,excluded
57,2022,packet-level and flow-level network intrusion detection based on reinforcement learning and adversarial training,"['b yang', 'mh arshad', 'q zhao']",algorithms,google,13,,4.333333333333333,Q2,quartile,excluded,excluded
59,2024,ids-anta: an open-source code with a defense mechanism to detect adversarial attacks for intrusion detection system,"['k barik', 's misra']",software impacts,google,9,,9,Q3,quartile,excluded,excluded
60,2023,dynamic distributed generative adversarial network for intrusion detection system over internet of things,"['s balaji', 'ss narayanan']",wireless networks,google,16,,8,Q2,quartile,excluded,excluded
61,2022,gaainet: a generative adversarial artificial immune network model for intrusion detection in industrial iot systems,"['sp sithungu', 'em ehlers']",journal of advances in information technology,google,27,,9,Q3,quartile,excluded,excluded
62,2024,constrained optimization based adversarial example generation for transfer attacks in network intrusion detection systems,"['m chale', 'b cox', 'j weir', 'nd bastian']",optimization letters,google,11,,11,Q2,quartile,excluded,excluded
70,2024,evaluating the impact of generative adversarial models on the performance of anomaly intrusion detection,"['m arafah', 'i phillips', 'a adnane']",iet networks,google,7,,7,Q3,quartile,excluded,excluded
97,2023,network intrusion detection based on conditional wasserstein variational autoencoder with generative adversarial network and one-dimensional convolutional neural …,"['j he', 'x wang', 'y song', 'q xiang', 'c chen']",applied intelligence,google,18,,9,Q2,quartile,excluded,excluded
119,2022,mitigation of black-box attacks on intrusion detection systems-based ml,"['s alahmed', 'q alasad', 'mm hammood', 'js yuan']",computers,google,18,,6,Q2,quartile,excluded,excluded
122,2024,cloud intrusion detection framework using variational auto encoder wasserstein generative adversarial network optimized with archerfish hunting optimization …,"['g senthilkumar', 'k tamilarasi', 'jk periasamy']",wireless networks,google,8,,8,Q2,quartile,excluded,excluded
162,2022,improved bidirectional gan-based approach for network intrusion detection using one-class classifier,"['w xu', 'j jang-jaccard', 't liu', 'f sabrina', 'j kwak']",computers,google,30,,10,Q2,quartile,excluded,excluded
197,2024,current status and challenges and future trends of deep learning-based intrusion detection models,"['y wu', 'b zou', 'y cao']",journal of imaging,google,5,,5,Q2,quartile,excluded,excluded
242,2024,intrusion detection based on adaptive sample distribution dual-experience replay reinforcement learning,"['h tan', 'l wang', 'd zhu', 'j deng']",mathematics,google,8,,8,Q2,quartile,excluded,excluded
251,2022,a gan-based intrusion detection model for 5g enabled future metaverse,"['s ding', 'l kou', 't wu']",mobile networks and applications,google,52,,17.333333333333329,Q2,quartile,excluded,excluded
253,2023,a novel multi-module integrated intrusion detection system for high-dimensional imbalanced data,"['j cui', 'l zong', 'j xie', 'm tang']",applied intelligence,google,103,,51.5,Q2,quartile,excluded,excluded
265,2023,iot intrusion detection model based on gated recurrent unit and residual network,"['g zhao', 'c ren', 'j wang', 'y huang', 'h chen']",peer-to-peer networking and applications,google,11,,5.5,Q2,quartile,excluded,excluded
291,2022,an enhanced intrusion detection system for iot networks based on deep learning and knowledge graph,"['x yang', 'g peng', 'd zhang', 'y lv']",security and communication networks (discontinued),google,40,,13.33333333333333,-,quartile,excluded,excluded
296,2024,model-agnostic generation-enhanced technology for few-shot intrusion detection,"['j he', 'l yao', 'x li', 'mk khan', 'w niu', 'x zhang', 'f li']",applied intelligence,google,7,,7,Q2,quartile,excluded,excluded
297,2023,xa-ganomaly: an explainable adaptive semi-supervised learning method for intrusion detection using ganomaly,"['y han', 'h chang']","computers, materials and continua",google,7,,3.5,Q2,quartile,excluded,excluded
326,2024,a holistic review of machine learning adversarial attacks in iot networks,"['h khazane', 'm ridouani', 'f salahdine', 'n kaabouch']",future internet,google,23,,23,Q2,quartile,excluded,excluded
337,2022,deep q-learning based reinforcement learning approach for network intrusion detection,"['h alavizadeh', 'h alavizadeh', 'j jang-jaccard']",computers,google,161,,53.666666666666657,Q2,quartile,excluded,excluded
362,2023,dependable intrusion detection system using deep convolutional neural network: a novel framework and performance evaluation approach,"['v hnamte', 'j hussain']",telematics and informatics reports,google,64,,32,Q2,quartile,excluded,excluded
378,2023,an adversarial dbn-lstm method for detecting and defending against ddos attacks in sdn environments,"['l chen', 'z wang', 'r huo', 't huang']",algorithms,google,22,,11,Q2,quartile,excluded,excluded
380,2024,comparative analysis of machine learning models for intrusion detection systems,"['v sharma', 'm kumar']",panamerican mathematical journal,google,1,,1,Q4,quartile,excluded,excluded
442,2024,a transferable deep learning framework for improving the accuracy of internet of things intrusion detection,"['h kim', 's park', 'h hong', 'j park', 's kim']",future internet,google,4,,4,Q2,quartile,excluded,excluded
474,2023,"a systematic and comprehensive survey of recent advances in intrusion detection systems using machine learning: deep learning, datasets, and attack taxonomy","['a momand', 'su jan', 'n ramzan']",journal of sensors,google,38,,19,Q3,quartile,excluded,excluded
490,2024,enhancing intrusion detection systems with reinforcement learning: a comprehensive survey of rl-based approaches and techniques,"['f louati', 'fb ktata', 'i amous']",sn computer science,google,3,,3,Q2,quartile,excluded,excluded
492,2024,network intrusion detection system by learning jointly from tabular and text‐based features,"['b düzgün', 'a çayır', 'u ünal', 'h dağ']",expert systems,google,10,,10,Q2,quartile,excluded,excluded
503,2022,privacy‐enhanced intrusion detection and defense for cyber‐physical systems: a deep reinforcement learning approach,"['q lin', 'r ming', 'k zhang', 'h luo']",security and communication networks (discontinued),google,9,,3,-,quartile,excluded,excluded
505,2025,"a cutting-edge framework for industrial intrusion detection: privacy-preserving, cost-friendly, and powered by federated learning","['l zhu', 'b zhao', 'j guo', 'm ji', 'j peng']",applied intelligence,google,0,,,Q2,quartile,excluded,excluded
507,2023,toward improved machine learning-based intrusion detection for internet of things traffic,"['s alkadi', 's al-ahmadi', 'mm ben ismail']",computers,google,14,,7,Q2,quartile,excluded,excluded
517,2023,analyze textual data: deep neural network for adversarial inversion attack in wireless networks,['ma al ghamdi'],sn applied sciences,google,3,,1.5,Q2,quartile,excluded,excluded
535,2025,deep intrusion net: an efficient framework for network intrusion detection using hybrid deep tcn and gru with integral features,"['ya rani', 'es reddy']",wireless networks,google,3,,inf,Q2,quartile,excluded,excluded
540,2024,advanced hybrid transformer-cnn deep learning model for effective intrusion detection systems with class imbalance mitigation using resampling …,"['h kamal', 'm mashaly']",future internet,google,6,,6,Q2,quartile,excluded,excluded
566,2023,research on hybrid intrusion detection based on improved harris hawk optimization algorithm,"['p zhou', 'h zhang', 'w liang']",connection science,google,22,,11,Q2,quartile,excluded,excluded
598,2023,the top ten artificial intelligence-deep neural networks for iot intrusion detection system,"['v kanimozhi', 'tp jacob']",wireless personal communications,google,9,,4.5,Q2,quartile,excluded,excluded
601,2025,a comprehensive survey on deep learning‐based intrusion detection systems in internet of things (iot),"['qa al‐haija', 'a droos']",expert systems,google,3,,inf,Q2,quartile,excluded,excluded
627,2024,original research article network intrusion detection using ensemble weighted voting classifier based honeypot framework,"['p pothumani', 'es reddy']",journal of autonomous intelligence,google,5,,5,Q4,quartile,excluded,excluded
647,2025,overview on intrusion detection systems for computers networking security,"['l diana', 'p dini', 'd paolini']",computers,google,3,,inf,Q2,quartile,excluded,excluded
653,2024,adaptive weighted kernel support vector machine-based circle search approach for intrusion detection in iot environments,"['c geetha', 'sd johnson', 'as oliver', 'd lekha']","signal, image and video processing",google,6,,6,Q2,quartile,excluded,excluded
667,2022,fidchain: federated intrusion detection system for blockchain-enabled iot healthcare applications,"['e ashraf', 'nff areed', 'h salem', 'eh abdelhay', 'a farouk']",healthcare,google,76,,25.333333333333329,Q2,quartile,excluded,excluded
671,2023,intrusion detection for high-speed railways based on unsupervised anomaly detection models,"['y wang', 'z yu', 'l zhu']",applied intelligence,google,20,,10,Q2,quartile,excluded,excluded
673,2022,an efficient network intrusion detection and classification system,"['i ahmad', 'qe ul haq', 'm imran', 'mo alassafi']",mathematics,google,55,,18.333333333333329,Q2,quartile,excluded,excluded
696,2023,design of advanced intrusion detection systems based on hybrid machine learning techniques in hierarchically wireless sensor networks,"['gg gebremariam', 'j panda', 's indu']",connection science,google,24,,12,Q2,quartile,excluded,excluded
706,2024,"systematic literature review on intrusion detection systems: research trends, algorithms, methods, datasets, and limitations","['mm issa', 'm aljanabi', 'hm muhialdeen']",journal of intelligent systems,google,7,,7,Q3,quartile,excluded,excluded
781,2022,generate qualified adversarial attacks and foster enhanced models based on generative adversarial networks,"['j he', 'l luo', 'k xiao', 'x fang', 'y li']",intelligent data analysis,google,1,,0.33333333333333331,Q3,quartile,excluded,excluded
793,2024,a multi-constraint transfer approach with additional auxiliary domains for iot intrusion detection under unbalanced samples distribution,"['r liu', 'w ma', 'j guo']",applied intelligence,google,2,,2,Q2,quartile,excluded,excluded
811,2024,a complete eda and dl pipeline for softwarized 5g network intrusion detection,['a moubayed'],future internet,google,2,,2,Q2,quartile,excluded,excluded
817,2024,unsupervised intrusion detection for rail transit based on anomaly segmentation,"['y shen', 'd he', 'q liu', 'z jin', 'x li', 'c ren']","signal, image and video processing",google,3,,3,Q2,quartile,excluded,excluded
834,2023,a novel hierarchical attention-based triplet network with unsupervised domain adaptation for network intrusion detection,"['j lan', 'x liu', 'b li', 'j zhao']",applied intelligence,google,13,,6.5,Q2,quartile,excluded,excluded
840,2024,deep learning for intrusion detection systems (idss) in time series data,"['k psychogyios', 'a papadakis', 's bourou', 'n nikolaou']",future internet,google,10,,10,Q2,quartile,excluded,excluded
856,2022,semi-supervised learning for optical fiber sensor road intrusion signal detection,"['j he', 'x hu', 'd zhang', 'y kong', 'j cheng', 'w xiao']",applied optics,google,9,,3,Q2,quartile,excluded,excluded
878,2023,smart intrusion detection in iot edge computing using federated learning,"['s fenanir', 'f semchedine']",revue d'intelligence artificielle,google,8,,4,Q4,quartile,excluded,excluded
940,2023,network intrusion detection based on explainable artificial intelligence,"['y wang', 'l xu', 'w liu', 'r li', 'j gu']",wireless personal communications,google,13,,6.5,Q2,quartile,excluded,excluded
942,2023,an intelligent approach of intrusion detection in mobile crowd sourcing systems in the context of iot based smart city,"['mvvp kantipudi', 'r aluvalu', 's velamuri']",smart science,google,18,,9,Q2,quartile,excluded,excluded
966,2022,a survey on intrusion detection systems for fog and cloud computing,"['v chang', 'l golightly', 'p modesti', 'qa xu', 'lmt doan']",future internet,google,90,,30,Q2,quartile,excluded,excluded
987,2024,lsf-idm: deep learning-based lightweight semantic fusion intrusion detection model for automotive,"['p cheng', 'l hua', 'h jiang', 'g liu']",peer-to-peer networking and applications,google,1,,1,Q2,quartile,excluded,excluded
1004,2023,a review of adversarial machine learning for cyber security in intelligent systems using image classification & signal classification analysis,t. jahan,ieee international conference on ict in business industry & government (ictbig),ieee,0,3,0,,h5-index,excluded,excluded
1005,2024,a novel deep reinforcement learning (drl) method for detecting evasion attack in iot environment,s. ramachandran; p. d,international conference on integrated circuits and communication systems (icicacs),ieee,0,7,0,,h5-index,excluded,excluded
1035,2025,optimizing intrusion detection with hybrid deep learning models and data balancing techniques,m. n. sarwar; m. s. arman; t. bhuiyan; f. b. rafiq,ieee international conference on ai in cybersecurity (icaic),ieee,1,0,inf,,h5-index,excluded,excluded
1047,2023,network intrusion detection method based on conditional generative adversarial network integrating multi-scale cnn,z. geng; x. xi; x. hu; y. han,ieee data driven control and learning systems conference (ddcls),ieee,1,13,0.5,,h5-index,excluded,excluded
1049,2024,a2hd: adaptive adversarial training for hyperdimensional computing-based intrusion detection against adversarial attacks,o. gungor; t. rosing; b. aksanli,ieee international conference on cyber security and resilience (csr),ieee,0,12,0,,h5-index,excluded,excluded
1051,2024,classification of deep learning methods in intrusion detection for iot devices,k. ashish; k. manoj,international conference on data science and network security (icdsns),ieee,1,6,1,,h5-index,excluded,excluded
1075,2024,research on network information security algorithms based intrusion detection using deep learning,k. pan,international conference on integrated circuits and communication systems (icicacs),ieee,1,7,1,,h5-index,excluded,excluded
1076,2024,verifying the robustness of machine learning based intrusion detection against adversarial perturbation,e. nowroozi; r. taheri; m. hajizadeh; t. bauschert,ieee international conference on cyber security and resilience (csr),ieee,2,12,2,,h5-index,excluded,excluded
1088,2024,advanced machine learning approaches for zero-day attack detection: a review,f. el husseini; h. noura; o. salman; a. chehab,cyber security in networking conference (csnet),ieee,1,12,1,,h5-index,excluded,excluded
1090,2024,adversarial attacks in intrusion detection systems: triggering false alarms in connected and autonomous vehicles,f. aloraini; a. javed,ieee international conference on cyber security and resilience (csr),ieee,1,12,1,,h5-index,excluded,excluded
1097,2024,security enhancement in network based intrusion detection using natural language processing with gan concept and began model,a. sanjivanrao more; k. harishchandra nimbalkar; n. v. jatale; a. hanumant kale; h. a. nagargoje,ieee international conference on blockchain and distributed systems security (icbds),ieee,0,6,0,,h5-index,excluded,excluded
1101,2024,cross-domain cybersecurity: integrated intrusion detection framework,v. kurnala; h. s. kanigolla; m. manda; a. meda,global conference on communications and information technologies (gccit),ieee,0,0,0,,h5-index,excluded,excluded
1113,2022,adversarial machine learning attacks in internet of things systems,r. kone; o. toutsop; k. w. thierry; k. kornegay; j. falaye,ieee applied imagery pattern recognition workshop (aipr),ieee,4,13,1.333333333333333,,h5-index,excluded,excluded
1125,2024,research on computer network intrusion detection algorithm based on deep learning,w. junbo,"ieee international conference on automation, electronics and electrical engineering (auteee)",ieee,0,11,0,,h5-index,excluded,excluded
1126,2023,enhancing cyber-physical system security with cgan in fog environment,p. pathak; d. singh; a. saxena; k. kumar; s. singh dari; d. dhabliya,international conference on data science and network security (icdsns),ieee,0,6,0,,h5-index,excluded,excluded
1127,2022,hybrid intrusion detection technique for malicious network attacks with machine learning,a. ibor; m. agana; b. ele; i. eteng; p. ana,"international conference on electrical, computer and energy technologies (icecet)",ieee,1,13,0.33333333333333331,,h5-index,excluded,excluded
1131,2023,explainable adversarial mitigation framework for zero-trust cyber warfare,e. c. nkoro; c. i. nwakanma; j. -m. lee; d. -s. kim,international conference on information and communication technology convergence (ictc),ieee,1,0,0.5,,h5-index,excluded,excluded
1143,2023,“real attackers don't compute gradients”: bridging the gap between adversarial ml research and practice,g. apruzzese; h. s. anderson; s. dambra; d. freeman; f. pierazzi; k. roundy,ieee conference on secure and trustworthy machine learning (satml),ieee,116,0,58,,h5-index,excluded,excluded
1158,2024,denoising diffusion generative adversarial network integrating multi-scale cnn,y. cao; f. dong; z. xin; z. wei; l. han,ieee data driven control and learning systems conference (ddcls),ieee,0,13,0,,h5-index,excluded,excluded
1159,2023,enhanced intrusion detection system using pearson correlation based long short-term memory,r. phadke; k. s. kumar; m. almusawi; n. baskar; z. a. almoussawi,international conference on integrated intelligence and communication systems (iciics),ieee,0,1,0,,h5-index,excluded,excluded
1163,2024,intrusion detection and prevention system for ddos attacks using hybrid cnn architecture,s. rathika; d. aggarwal; x. v k; p. r. rege; n. thangarasu; p. kaur,global conference on communications and information technologies (gccit),ieee,0,0,0,,h5-index,excluded,excluded
1184,2024,intrusion detection landscape: exploring progress and confronting challenges in security advances,m. usman f; p. s; s. m r; y. b; s. b. k n; t. akash k; m. r. ahmed,international conference on integrated circuits and communication systems (icicacs),ieee,0,7,0,,h5-index,excluded,excluded
1185,2024,a feature selection based decisive red fox algorithm with deep learning for protecting cybersecurity network,s. dontu; s. r. addula; p. kumar pareek; r. vallabhaneni; m. h. fallah,international conference on intelligent algorithms for computational intelligence systems (iacis),ieee,0,0,0,,h5-index,excluded,excluded
1186,2024,introspective intrusion detection system through explainable ai,b. g. paltun; r. fuladi,cyber security in networking conference (csnet),ieee,1,12,1,,h5-index,excluded,excluded
1206,2024,an ensemble approach to identify intrusions in edge iot and iiot networks,v. kurnala; s. r. kalam,global conference on communications and information technologies (gccit),ieee,0,0,0,,h5-index,excluded,excluded
1208,2024,ai-powered video surveillance for enhanced intrusion detection,c. sivakumar; t. k. vali; p. s. b. reddy; m. l. meghana; y. sukumar,international conference on iot based control networks and intelligent systems (icicnis),ieee,0,0,0,,h5-index,excluded,excluded
1210,2023,improving the detection of unknown ddos attacks through continual learning,b. nugraha; k. yadav; p. patil; t. bauschert,ieee international conference on cyber security and resilience (csr),ieee,2,12,1,,h5-index,excluded,excluded
1211,2023,application of deep learning for intrusion detection and cyber-attack detection using internet of things networks,a. gautam; s. rathare; g. bhatnagar; s. ikhar; s. s. dari; v. k. gupta,international conference on data science and network security (icdsns),ieee,0,6,0,,h5-index,excluded,excluded
1218,2023,end-to-end network security solutions using deep learning algorithms,sonulal; m. n. reddy; n. bhatt; s. pandey,ieee international conference on ict in business industry & government (ictbig),ieee,0,3,0,,h5-index,excluded,excluded
1219,2023,intrusion detection in healthcare using sand-cat optimization based long-short term memory,r. ramya; a. h. a. hussein; m. m. adnan; n. shilpa; s. priya,international conference on integrated intelligence and communication systems (iciics),ieee,1,1,0.5,,h5-index,excluded,excluded
1222,2024,predictive vigilance: ai and ml methods for ddos attack detection and forecasting,ravikumar.s; r. p; r. s; k. a. kumar; s. s,global conference on communications and information technologies (gccit),ieee,0,0,0,,h5-index,excluded,excluded
1223,2024,cyberattack risk classification for detecting intrusions through n euro- fuzzy inference based generative adversarial networks,m. torres; s. m. errapotu; v. gonzalez,"international conference on electrical, computer and energy technologies (icecet)",ieee,0,13,0,,h5-index,excluded,excluded
1234,2023,transfer learning innovations in network security and threat intelligence,a. mishra; s. kumar; d. pipalia; r. vaish,ieee international conference on ict in business industry & government (ictbig),ieee,0,3,0,,h5-index,excluded,excluded
1236,2023,building ddos resilient sdns using hybridised deep learning methods,j. mateus; g. -a. l. zodi; a. bagula; m. landry,international conference on emerging trends in networks and computer communications (etncc),ieee,2,0,1,,h5-index,excluded,excluded
1248,2024,deep graph learning for ddos detection and multi-class classification ids,b. j. saunders; r. e. de grande; g. h. s. carvalho; i. woungang,ieee international conference on cyber security and resilience (csr),ieee,0,12,0,,h5-index,excluded,excluded
1263,2023,a feature-aware semi-supervised learning approach for automotive ethernet,k. h. shibly; m. d. hossain; h. inoue; y. taenaka; y. kadobayashi,ieee international conference on cyber security and resilience (csr),ieee,5,12,2.5,,h5-index,excluded,excluded
1273,2023,efficient early anomaly detection of network security attacks using deep learning,t. ahmad; d. truscan,ieee international conference on cyber security and resilience (csr),ieee,3,12,1.5,,h5-index,excluded,excluded
1284,2022,a co-evolutionary algorithm-based malware adversarial sample generation method,f. wang; y. lu; q. li; c. wang; y. bai,ieee conference on dependable and secure computing (dsc),ieee,1,14,0.33333333333333331,,h5-index,excluded,excluded
1290,2024,iot network intrusion detection with deep learning and voice alerts,d. s; d. m. r. s,international conference on iot based control networks and intelligent systems (icicnis),ieee,0,0,0,,h5-index,excluded,excluded
1293,2024,using generative adversarial networks for anomaly detection in network traffic: advancements in ai cybersecurity,r. changala; s. kayalvili; m. farooq; l. m. rao; v. s. rao; s. muthuperumal,international conference on data science and network security (icdsns),ieee,2,6,2,,h5-index,excluded,excluded
1308,2024,roadmap for integrating open ran and ai for intrusion detection systems in 6g networks,l. a. c. ahakonye; c. i. nwakanma; d. -s. kim,international conference on information and communication technology convergence (ictc),ieee,0,0,0,,h5-index,excluded,excluded
1315,2024,enhancing cybersecurity: the development of a flexible deep learning model for enhanced anomaly detection,h. gonaygunta; g. s. nadella; p. pramod pawar; d. kumar,systems and information engineering design symposium (sieds),ieee,51,11,51,,h5-index,excluded,excluded
1319,2024,"security and privacy-preserving for machine learning models: attacks, countermeasures, and future directions",f. el-husseini; h. noura; f. vernier,cyber security in networking conference (csnet),ieee,0,12,0,,h5-index,excluded,excluded
1321,2023,hybrid optimization based convolutional neural network for intrusion detection system,s. n; b. girirajan; k. s. kumar; b. s. d. priya; s. m,international conference on evolutionary algorithms and soft computing techniques (easct),ieee,0,3,0,,h5-index,excluded,excluded
1323,2023,a two-layer dimension reduction and two-tier classification model for anomaly-based intrusion detection in iot,r. n. kamath; a. amrutha; s. jangirala; s. bharathidasan,international conference on evolutionary algorithms and soft computing techniques (easct),ieee,1,3,0.5,,h5-index,excluded,excluded
