workbook_record_id,year,title,author_list,venue,engine,citation_count,h5_index,mean_citation,quartile,quality_signal_available,screening_status,source_sheet
1324,2023,generative adversarial networks for cybersecurity threat,a. c. ojha; a. agarwal; g. swetha,international conference on recent advances in science and engineering technology (icraset),ieee,0,0,0,,h5-index,excluded,excluded
1325,2023,evolutionary algorithms for deep learning in secure network environments,j. omkar; n. patel; v. rawat,ieee international conference on ict in business industry & government (ictbig),ieee,0,3,0,,h5-index,excluded,excluded
1342,2024,fortifying smart city iot networks: a deep learning-based attack detection framework with optimized feature selection using mgs-roa,r. v. rayala; c. r. borra; p. k. pareek; s. cheekati,international conference on recent advances in science and engineering technology (icraset),ieee,0,0,0,,h5-index,excluded,excluded
1377,2024,research on communication network attack detection and defense mechanism based on deep learning,l. ludun,"ieee international conference on automation, electronics and electrical engineering (auteee)",ieee,0,11,0,,h5-index,excluded,excluded
1382,2024,exploring automated defense technology of artificial intelligence in network security,w. ye; l. zhou; j. mo; z. zeng,international conference on distributed computing and electrical circuits and electronics (icdcece),ieee,0,11,0,,h5-index,excluded,excluded
1385,2024,leveraging artificial intelligence and machine learning for enhanced privacy and security,s. rani; n. kumar; a. srivastva; a. sharma,ieee international conference on blockchain and distributed systems security (icbds),ieee,2,6,2,,h5-index,excluded,excluded
1395,2024,a tale of two methods: unveiling the limitations of gan and the rise of bayesian networks for synthetic network traffic generation,a. schoen; g. blanc; p. -f. gimenez; y. han; f. majorczyk; l. me,ieee european symposium on security and privacy workshops (euros&pw),ieee,2,0,2,,h5-index,excluded,excluded
1403,2025,artificial intelligence for cybersecurity: a state of the art,a. a. siam; m. m. hassan; t. bhuiyan,ieee international conference on ai in cybersecurity (icaic),ieee,0,0,,,h5-index,excluded,excluded
1405,2024,iot security detection and evaluation for smart cyber infrastructures using lstms with attention mechanism,s. e. v. s. pillai; k. polimetla; c. s. prakash; p. k. pareek; p. p. pawar,international conference on distributed computing and electrical circuits and electronics (icdcece),ieee,1,11,1,,h5-index,excluded,excluded
1421,2024,machine learning-based feature selection for intrusion detection systems in iec 61850-based digital substations,a. eynawi; a. mumrez; g. elbez; v. hagenmeyer,"ieee international conference on communications, control, and computing technologies for smart grids (smartgridcomm)",ieee,0,0,0,,h5-index,excluded,excluded
1425,2023,robust anomaly detection in network traffic using deep learning models,a. nema; r. s. tomar; a. mani,ieee international conference on ict in business industry & government (ictbig),ieee,1,3,0.5,,h5-index,excluded,excluded
1439,2024,enhancing ids with ensemble lstm networks using real and gan data,r. saia; s. carta; g. fenu; a. s. podda; l. pompianu,international telecommunication networks and applications conference (itnac),ieee,0,14,0,,h5-index,excluded,excluded
1440,2024,leveraging ai for enhanced botnet detection - a review of machine learning approach for cybersecurity,h. sonune; n. kulkarni,ieee international conference on blockchain and distributed systems security (icbds),ieee,0,6,0,,h5-index,excluded,excluded
1453,2024,enhancing cybersecurity in the digital age with machine learning for threat detection and prevention,p. j. jayarin; d. b. david; jenifa; v. s. kumari; n. m. pillai,international conference on recent advances in science and engineering technology (icraset),ieee,0,0,0,,h5-index,excluded,excluded
1466,2024,detection evasion using ebpf for linux fileless malware,y. takabayashi; m. mambo,ieee conference on dependable and secure computing (dsc),ieee,0,14,0,,h5-index,excluded,excluded
1467,2022,network anomaly detection based on domain adaptation for 5g network security,h. -j. kim; j. lee; c. park; j. -g. park,international conference on information and communication technology convergence (ictc),ieee,5,0,1.666666666666667,,h5-index,excluded,excluded
1477,2023,novel anomaly detection scheme for cyber physical system using c-gan in fog assisted iot environment,a. mathur; s. a. babu,international conference on distributed computing and electrical circuits and electronics (icdcece),ieee,0,11,0,,h5-index,excluded,excluded
1481,2023,evaluating machine learning approaches for cyber and physical anomalies in scada systems,l. faramondi; f. flammini; s. guarino; r. setola,ieee international conference on cyber security and resilience (csr),ieee,11,12,5.5,,h5-index,excluded,excluded
1503,2024,hyper q-learning algorithm for pursuit-evasion games with misperceptions,y. li; h. zhang; s. liang,ieee international conference on unmanned systems (icus),ieee,0,13,0,,h5-index,excluded,excluded
1528,2024,analytical solution for escape region in coplanar spacecraft pursuit- evasion game,q. yang; y. luo; z. li; y. xiao,ieee international conference on unmanned systems (icus),ieee,0,13,0,,h5-index,excluded,excluded
1532,2024,effective anomaly detection in 5g networks via transformer-based models and contrastive learning,s. sheikhi; p. kostakos; s. pirttikangas,cyber security in networking conference (csnet),ieee,0,12,0,,h5-index,excluded,excluded
1535,2022,lstm-based anomalous behavior detection in multi-agent reinforcement learning,c. lischke; t. liu; j. mccalmon; m. a. rahman; t. halabi; s. alqahtani,ieee international conference on cyber security and resilience (csr),ieee,1,12,0.33333333333333331,,h5-index,excluded,excluded
1543,2023,preprocessing network traffic using topological data analysis for data poisoning detection,g. f. monkam; m. j. d. lucia; n. d. bastian,ieee conference on dependable and secure computing (dsc),ieee,1,14,0.5,,h5-index,excluded,excluded
1548,2024,classifying network abnormalities into faults and attacks in iot-based cyber-physical systems using machine learning,p. j. kumar; l. h. j. alzubaidi; n. nagarjuna; r. deshmukh; m. g k,international conference on integrated circuits and communication systems (icicacs),ieee,40,7,40,,h5-index,excluded,excluded
1553,2024,ensemble models for cyber attacks detection on multiple datasets,y. s. kumar; a. mary sowjanya,international conference on iot based control networks and intelligent systems (icicnis),ieee,0,0,0,,h5-index,excluded,excluded
1560,2023,neural architectures for secure data transmission in next-gen networks,p. aggarwal,ieee international conference on ict in business industry & government (ictbig),ieee,1,3,0.5,,h5-index,excluded,excluded
1572,2023,hybrid grasshopper whale optimization algorithm based on faster recurrent convolutional neural network for intrusion detection system in internet of things,s. s. kumar; v. goutham; y. prathima; r. unnisa; a. t m,international conference on evolutionary algorithms and soft computing techniques (easct),ieee,0,3,0,,h5-index,excluded,excluded
1596,2022,malicious and benign url dataset generation using character-level lstm models,s. vecile; k. lacroix; k. grolinger; j. samarabandu,ieee conference on dependable and secure computing (dsc),ieee,5,14,1.666666666666667,,h5-index,excluded,excluded
1609,2024,improving network security with hybrid model for ddos attack detection,m. dandotiya; r. r. singh makwana,ieee international conference on blockchain and distributed systems security (icbds),ieee,0,6,0,,h5-index,excluded,excluded
1630,2024,network threat awareness model with smart grid for big data analysis,h. dang; d. shao; l. yue,international conference on distributed computing and electrical circuits and electronics (icdcece),ieee,0,11,0,,h5-index,excluded,excluded
1634,2023,"genai in the cyber kill chain: a comprehensive review of risks, threat operative strategies and adaptive defense approaches",a. s. deshpande; s. gupta,ieee international conference on ict in business industry & government (ictbig),ieee,4,3,2,,h5-index,excluded,excluded
1637,2023,intrusion detection system in iot using grey wolf optimization-based support vector machine,k. ramakrishna; n. yamsani; i. h. mohammed; h. mohammad; k. al-attabi,international conference on integrated intelligence and communication systems (iciics),ieee,0,1,0,,h5-index,excluded,excluded
1658,2023,to ttp or not to ttp?: exploiting ttps to improve ml-based malware detection,y. sharma; e. giunchiglia; s. birnbach; i. martinovic,ieee international conference on cyber security and resilience (csr),ieee,7,12,3.5,,h5-index,excluded,excluded
1661,2023,a simple yet efficient unsupervised anomaly detection network for industrial machine,d. wu; q. chen,"ieee international conference on automation, electronics and electrical engineering (auteee)",ieee,0,11,0,,h5-index,excluded,excluded
1663,2024,"a comprehensive survey on anomaly detection in social media networks: challenges, methods, and future directions",s. lunawat; j. rao; p. patil,international conference on sustainable expert systems (icses),ieee,1,6,1,,h5-index,excluded,excluded
1674,2022,a generative model for evasion attacks in smart grid,v. p. k. madhavarapu; s. bhattacharjee; s. k. dasy,ieee infocom - ieee conference on computer communications workshops (infocom wkshps),ieee,3,0,1,,h5-index,excluded,excluded
1675,2022,a pursuit strategy for multi-agent pursuit-evasion game via multi-agent deep deterministic policy gradient algorithm,j. ye; q. wang; b. ma; y. wu; l. xue,ieee international conference on unmanned systems (icus),ieee,6,13,2,,h5-index,excluded,excluded
1684,2023,optimal maneuvering strategy of spacecraft evasion based on angles-only measurement and observability analysis,y. zhang; j. wang; b. hou; d. wang; y. chen,journal of systems engineering and electronics,ieee,7,,3.5,Q2,quartile,excluded,excluded
1691,2022,are malware detection models adversarial robust against evasion attack?,h. rathore; a. samavedhi; s. k. sahay; m. sewak,ieee infocom - ieee conference on computer communications workshops (infocom wkshps),ieee,1,0,0.33333333333333331,,h5-index,excluded,excluded
1695,2023,natural language processing in healthcare: intelligent system for extracting insights from clinical text data,c. rashmi; d. srinivas; s. prabu; p. n. santosh kumar; a. siddiqua,international conference on evolutionary algorithms and soft computing techniques (easct),ieee,2,3,1,,h5-index,excluded,excluded
1701,2024,a secure approach for strengthening session management with custom session handlers,u. kumaran; m. gurupriya; a. g. reddy; g. nithin; k. bhanusri,international conference on self sustainable artificial intelligence systems (icssas),ieee,0,10,0,,h5-index,excluded,excluded
1713,2023,attack tree analysis for adversarial evasion attacks,y. yamaguchi; t. aoki,ieee pacific rim international symposium on dependable computing (prdc),ieee,1,11,0.5,,h5-index,excluded,excluded
1724,2024,fail-controlled classifiers: do they know when they don’t know?,t. zoppi; f. a. khokhar; a. ceccarelli; l. montecchi; a. bondavalli,ieee pacific rim international symposium on dependable computing (prdc),ieee,0,11,0,,h5-index,excluded,excluded
1728,2023,many-to-one pursuit-evasion differential game method for uavs using sequential convex programming,h. tang; g. chen; c. bai; j. guo,ieee international conference on unmanned systems (icus),ieee,3,13,1.5,,h5-index,excluded,excluded
1735,2022,a hybrid anomaly detection model based on ganomaly in cloud environment,w. yang; c. zeng,ieee international conference on big data and artificial intelligence (bdai),ieee,2,8,0.66666666666666663,,h5-index,excluded,excluded
1765,2025,generative ai for automated security operations in cloud computing,a. patel; p. pandey; h. ragothaman; r. molleti; d. r. peddinti,ieee international conference on ai in cybersecurity (icaic),ieee,0,0,,,h5-index,excluded,excluded
1767,2024,pearson correlation coefficient based improved least square - support vector machine for cyber-attack detection in internet of things,a. senthilkumar; s. joshika; l. santhi; s. k s; p. charanarur,international conference on distributed computing and electrical circuits and electronics (icdcece),ieee,2,11,2,,h5-index,excluded,excluded
1771,2022,an optimal guidance method for free-time orbital pursuit-evasion game,c. zhang; y. zhu; l. yang; x. zeng,journal of systems engineering and electronics,ieee,8,,2.666666666666667,Q2,quartile,excluded,excluded
1772,2023,an automl based trajectory optimization method for long-distance spacecraft pursuit-evasion game,f. yang; l. yang; y. zhu,journal of systems engineering and electronics,ieee,1,,0.5,Q2,quartile,excluded,excluded
1790,2023,vulnerability exploit pattern generation and analysis for proactive security risk mitigation for 5g networks,w. sędkowski; r. p. bhatt; c. fernandes; k. ranganath,ieee infocom - ieee conference on computer communications workshops (infocom wkshps),ieee,1,0,0.5,,h5-index,excluded,excluded
1793,2024,work-in-progress: cangen: practical synthetic can traces generation using deep generative models,y. yin; j. g. merchan; p. pappachan; v. sekar,ieee european symposium on security and privacy workshops (euros&pw),ieee,1,0,1,,h5-index,excluded,excluded
1806,2023,a wolf in sheep’s clothing: query-free evasion attacks against machine learning-based malware detectors with generative adversarial networks,d. gibert; j. planes; q. le; g. zizzo,ieee european symposium on security and privacy workshops (euros&pw),ieee,13,0,6.5,,h5-index,excluded,excluded
1838,2024,label noise resistant f-divergence receiver for power line communications,n. novello; a. m. tonello,"ieee international conference on communications, control, and computing technologies for smart grids (smartgridcomm)",ieee,0,0,0,,h5-index,excluded,excluded
1869,2024,application of cyber-physical system models in detection and mitigation of cyberattacks in a transactive energy system: a review,o. tooki; o. popoola,international conference on emerging trends in networks and computer communications (etncc),ieee,1,0,1,,h5-index,excluded,excluded
1927,2024,counter-encirclement of uav in pursuit-evasion environment via improved rl,y. niu; y. tian; q. wang,ieee international conference on unmanned systems (icus),ieee,0,13,0,,h5-index,excluded,excluded
1945,2023,the zero-missed isolation of constrained collusive covert attacks in large-scale systems,d. zhao; g. wen,ieee international conference on unmanned systems (icus),ieee,0,13,0,,h5-index,excluded,excluded
1984,2022,identification of sars-cov-2 viral escape sequences using escapetrans network,p. s. bist; h. tavara; k. t. chong,international conference on information and communication technology convergence (ictc),ieee,2,0,0.66666666666666663,,h5-index,excluded,excluded
1994,2022,stealthy attack detection for privacy-preserving real-time pricing in smart grids,f. wu; x. wang; m. yang; h. zhang; x. wu; j. yu,asian control conference (ascc),ieee,0,11,0,,h5-index,excluded,excluded
1998,2023,attacking a packet analyzer: caronte case study,d. granata; m. rak; f. grimaldi,ieee international conference on cyber security and resilience (csr),ieee,0,12,0,,h5-index,excluded,excluded
2005,2024,qualitative analysis of visibility-based game with constrained attack range,s. bu; l. liang; z. wang; y. wang,asian control conference (ascc),ieee,0,11,0,,h5-index,excluded,excluded
2006,2024,improving adversarial attacks on graph neural networks with honey badger optimization and efficient parallel defense strategies,a. singla; m. sunil; d. dongre; v. d. babu; s. mahajan; p. sharmila,international conference on recent advances in science and engineering technology (icraset),ieee,0,0,0,,h5-index,excluded,excluded
2010,2024,safety-critical control for multi-agent collaborative pursuit,z. chang; q. he; z. li; h. yan,asian control conference (ascc),ieee,0,11,0,,h5-index,excluded,excluded
2016,2024,evasive spike variants elucidate the preservation of t cell immune response to the sars-cov-2 omicron variant,a. solanki; j. cornette; j. udell; g. vasmatzis; m. riedel,ieee/acm transactions on computational biology and bioinformatics,ieee,0,,0,Q2,quartile,excluded,excluded
2048,2023,red blood cell membrane camouflaged mesoporous silica nanorods as nanocarriers for synergistic chemo-photothermal therapy,s. zong; c. cao; k. chen; y. cui; j. li; z. wang,ieee transactions on nanobioscience,ieee,2,,1,Q2,quartile,excluded,excluded
2049,2023,a review of protein sequences of covid-19 using machine learning and deep learning approaches,a. golwelkar; a. kothari,ieee international conference on ict in business industry & government (ictbig),ieee,0,3,0,,h5-index,excluded,excluded
2066,2024,multi-stage multi-robot cooperative hunting with dynamic alliance,j. yang; h. wei; l. pan; h. shao; d. li; y. li; l. shi,ieee international conference on unmanned systems (icus),ieee,0,13,0,,h5-index,excluded,excluded
2081,2022,nash pursuit strategy for nonzero-sum mpc game via inverse optimal control,t. qiu; h. zhang; j. wang,asian control conference (ascc),ieee,3,11,1,,h5-index,excluded,excluded
2083,2023,stealthy attacks on multi-agent reinforcement learning in mobile cyber-physical systems,s. alqahtani; t. halabi,cyber security in networking conference (csnet),ieee,0,12,0,,h5-index,excluded,excluded
2126,2024,escape with self-adaptive decision radius based on deep deterministic policy gradient in pursuit games,x. zhou; c. yang; w. wang; p. sun,ieee data driven control and learning systems conference (ddcls),ieee,0,13,0,,h5-index,excluded,excluded
2129,2023,building robust machine learning models for water quality prediction,p. lourdu mahimai doss; m. gunasekaran,international conference on integrated intelligence and communication systems (iciics),ieee,0,1,0,,h5-index,excluded,excluded
2137,2024,detecting stealthy gps spoofing attack against uavs using onboard sensors,a. finn; m. jia; y. li; j. yuan,ieee infocom - ieee conference on computer communications workshops (infocom wkshps),ieee,1,0,1,,h5-index,excluded,excluded
2173,2023,the evolution of cybersecurity in the big data era moving beyond data protection to data-driven security,j. singh,ieee international conference on ict in business industry & government (ictbig),ieee,1,3,0.5,,h5-index,excluded,excluded
2199,2022,an investigation on fragility of machine learning classifiers in android malware detection,h. rafiq; n. aslam; b. issac; r. h. randhawa,ieee infocom - ieee conference on computer communications workshops (infocom wkshps),ieee,10,0,3.333333333333333,,h5-index,excluded,excluded
2235,2023,venomave: targeted poisoning against speech recognition,h. aghakhani; l. schönherr; t. eisenhofer; d. kolossa; t. holz; c. kruegel; g. vigna,ieee conference on secure and trustworthy machine learning (satml),ieee,24,0,12,,h5-index,excluded,excluded
2261,2024,improved malware detection in android through ensemble modeling,m. meena; j. gajrani,international conference on emerging trends in networks and computer communications (etncc),ieee,1,0,1,,h5-index,excluded,excluded
2284,2022,cybersecurity issues in communication-based electrical protections,g. b. gaggero; m. rossi; p. girdinio; m. marchese,"international conference on electrical, computer and energy technologies (icecet)",ieee,5,13,1.666666666666667,,h5-index,excluded,excluded
2361,2022,proposed architecture of integrate blockchain with vat system in oman,m. mohamad; k. al harthy,"international conference on electrical, computer and energy technologies (icecet)",ieee,1,13,0.33333333333333331,,h5-index,excluded,excluded
2439,2022,deep learning for classification of fdis on time-series sensor data in cyber-physical power systems,s. d. roy; s. debbarma,ieee mediterranean electrotechnical conference (melecon),ieee,3,14,1,,h5-index,excluded,excluded
2487,2024,entropy-based attack detection and filtering for enhanced message reception in can networks,h. m. ramesh; a. kumar; y. huang; m. t. hoque chowdhury; j. k. debnath; b. xie,"international conference on electrical, computer and energy technologies (icecet)",ieee,0,13,0,,h5-index,excluded,excluded
2490,2024,risc-v power analysis attack mitigation in a gpu execution framework,n. lungu; b. b. dash; m. r. mishra; p. pattnayak; m. k. gourisaria; s. s. patra,international conference on intelligent cyber physical systems and internet of things (icoici),ieee,0,0,0,,h5-index,excluded,excluded
2491,2023,enhancing remote work security: a multi-key biometric authentication scheme for virtual workspaces,t. gundu,"international conference on electrical, computer and energy technologies (icecet)",ieee,2,13,1,,h5-index,excluded,excluded
2496,2024,enhancing microgrid resilience to false data injection,s. das; z. wang,"ieee international conference on communications, control, and computing technologies for smart grids (smartgridcomm)",ieee,0,0,0,,h5-index,excluded,excluded
2500,2024,configurable ro-puf with improved thermal stability for lightweight applications,a. gupta; s. f. naz; a. p. shah,international conference on microelectronics (icm),ieee,0,13,0,,h5-index,excluded,excluded
2509,2023,a light recipe to train robust vision transformers,e. debenedetti; v. sehwag; p. mittal,ieee conference on secure and trustworthy machine learning (satml),ieee,69,0,34.5,,h5-index,excluded,excluded
2530,2023,gleam: gan and llm for evasive adversarial malware,d. devadiga; g. jin; b. potdar; h. koo; a. han; a. shringi; a. singh; k. chaudhari; s. kumar,international conference on information and communication technology convergence (ictc),ieee,7,0,3.5,,h5-index,excluded,excluded
2547,2024,advancing malware detection using memory analysis and explainable ai approach,r. ch; j. manoranjini; s. pallavi; u. naresh; s. telang; s. kiran,international conference on intelligent cyber physical systems and internet of things (icoici),ieee,4,0,4,,h5-index,excluded,excluded
2548,2022,h4rm0ny: a competitive zero-sum two-player markov game for multi-agent learning on evasive malware generation and detection,c. molloy; s. h. h. ding; b. c. m. fung; p. charland,ieee international conference on cyber security and resilience (csr),ieee,6,12,2,,h5-index,excluded,excluded
2557,2022,advanced persistent threat detection: a particle swarm optimization approach,a. al mamun; h. al-sahaf; i. welch; s. camtepe,international telecommunication networks and applications conference (itnac),ieee,7,14,2.333333333333333,,h5-index,excluded,excluded
2570,2024,evading black-box classifiers without breaking eggs,e. debenedetti; n. carlini; f. tramèr,ieee conference on secure and trustworthy machine learning (satml),ieee,8,0,8,,h5-index,excluded,excluded
2635,2024,detecting cryptographic functions for string obfuscation,p. mondon; r. de lemos,ieee international conference on cyber security and resilience (csr),ieee,0,12,0,,h5-index,excluded,excluded
2636,2023,assessing and exploiting domain name misinformation,b. anderson; d. mcgrew,ieee european symposium on security and privacy workshops (euros&pw),ieee,1,0,0.5,,h5-index,excluded,excluded
2659,2024,deep learning-based mitigation of fabricated attacks in the industrial internet of things,r. k. beldar,international conference on data science and network security (icdsns),ieee,0,6,0,,h5-index,excluded,excluded
2664,2024,loose formation obstacle avoidance control for multi-uav inspired by birds flocking based on power diagrams,t. zhang; y. liu; t. lu,ieee international conference on unmanned systems (icus),ieee,0,13,0,,h5-index,excluded,excluded
2669,2022,adversarial training against adversarial attacks for machine learning-based intrusion detection systems,muhammad shahzad haroon and husnain mansoor ali,"computers, materials and continua",sd,11,,3.666666666666667,Q2,quartile,excluded,excluded
2674,2024,network security enhanced with deep neural network-based intrusion detection system,fatma s. alrayes and mohammed zakariah and syed umar amin and zafar iqbal khan and jehad saad alqurni,"computers, materials and continua",sd,5,,5,Q2,quartile,excluded,excluded
2687,2024,"a review of generative adversarial networks for intrusion detection systems: advances, challenges, and future directions",monirah al-ajlan and mourad ykhlef,"computers, materials and continua",sd,1,,1,Q2,quartile,excluded,excluded
2704,2025,5dgwo-gan: a novel five-dimensional gray wolf optimizer for generative adversarial network-enabled intrusion detection in iot systems,sarvenaz sadat khatami and mehrdad shoeibi and anita ershadi oskouei and diego martã­n and maral keramat dashliboroun,"computers, materials and continua",sd,1,,inf,Q2,quartile,excluded,excluded
2735,2024,ariotedef: adversarially robust iot early defense system based on self-evolution against multi-step attacks,"huang, mengdie and lee, hyunwoo and kundu, ashish and chen, xiaofeng and mudgerikar, anand and li, ninghui and bertino, elisa",acm transactions on internet of things,acm,4,,4,Q2,quartile,excluded,excluded
2754,2024,aed: a novel approach for intrusion detection without abnormal samples in big data environment,"wang, xiaodong and qi, longyun and wei, xingshen and zhu, weiping and jiang, haitao and guan, zhitao",journal of data and information quality,acm,0,,0,Q2,quartile,excluded,excluded
2788,2023,joint iot/ml platforms for smart societies and environments: a review on multimodal information-based learning for safety and security,"attar, hani",journal of data and information quality,acm,10,,5,Q2,quartile,excluded,excluded
