workbook_record_id,year,title,author_list,venue,engine,citation_count,h5_index,mean_citation,quartile,quality_signal_available,screening_status,source_sheet
2820,2024,a dynamic threat prevention framework for autonomous vehicle networks based on ruin-theoretic security risk assessment,"anwar, anika and halabi, talal and zulkernine, mohammad",acm journal on autonomous transportation systems,acm,1,0,1,,h5-index,excluded,excluded
2903,2024,casper: context-aware iot anomaly detection system for industrial robotic arms,"kayan, hakan and heartfield, ryan and rana, omer and burnap, pete and perera, charith",acm transactions on internet of things,acm,9,,9,Q2,quartile,excluded,excluded
2907,2024,detecting poisoning attacks in collaborative idss of vehicular networks using xai and shapley value,"bataineh, ahmed saleh and zulkernine, mohammad and abusitta, adel and halabi, talal",acm journal on autonomous transportation systems,acm,1,0,1,,h5-index,excluded,excluded
2908,2024,systematic risk characterisation of hardware threats to automotive systems,"pickford, james and attale, rasadhi and shaikh, siraj and nguyen, hoang nga and harrison, lee",acm journal on autonomous transportation systems,acm,2,0,2,,h5-index,excluded,excluded
2958,2023,where do databases and digital forensics meet? a comprehensive survey and taxonomy,"seufitelli, danilo b. and brand\~{a}o, michele a. and fernandes, ayane c. a. and siqueira, kayque m. and moro, mirella m.",sigmod record,acm,1,,0.5,Q2,quartile,excluded,excluded
3076,2025,navigating tabular data synthesis research understanding user needs and tool capabilities,"davila r., maria f. and groen, sven and panse, fabian and wingerath, wolfram",sigmod record,acm,1,,inf,Q2,quartile,excluded,excluded
3079,2024,rampart: reinforcing autonomous multi-agent protection through adversarial resistance in transportation,"hossain, md tamjid and la, hung and badsha, shahriar",acm journal on autonomous transportation systems,acm,4,0,4,,h5-index,excluded,excluded
3134,2024,active learning for data quality control: a survey,"li, na and qi, yiyang and li, chaoran and zhao, zhiming",journal of data and information quality,acm,6,,6,Q2,quartile,excluded,excluded
3218,2023,fl4iot: iot device fingerprinting and identification using federated learning,"wang, han and eklund, david and oprea, alina and raza, shahid",acm transactions on internet of things,acm,15,,7.5,Q2,quartile,excluded,excluded
3279,2024,"security of electrical, optical, and wireless on-chip interconnects: a survey","weerasena, hansika and mishra, prabhat",acm transactions on design automation of electronic systems,acm,12,,12,Q2,quartile,excluded,excluded
3283,2022,"a survey on iot profiling, fingerprinting, and identification","safi, miraqa and dadkhah, sajjad and shoeleh, farzaneh and mahdikhani, hassan and molyneaux, heather and ghorbani, ali a.",acm transactions on internet of things,acm,53,,17.666666666666671,Q2,quartile,excluded,excluded
3292,2022,fast concurrent data sketches,"rinberg, arik and spiegelman, alexander and bortnikov, edward and hillel, eshcar and keidar, idit and rhodes, lee and serviansky, hadar",acm transactions on parallel computing,acm,15,,5,Q3,quartile,excluded,excluded
3302,2025,intrusion detection using ctgan and lightweight neural network for internet of things,das s.; majumder a.; namasudra s.; singh a.,expert systems,scopus,5,,inf,Q2,quartile,excluded,excluded
3303,2025,machine learning-inspired intrusion detection on vehicular communication for route planning,khatua s.; das s.; nandi a.; kumar a.; de d.; roy s.,lecture notes in networks and systems,scopus,0,,,Q4,quartile,excluded,excluded
3304,2025,framework for brute-force attack detection using federated learning,chethana datta j.; ananya s.; deepak m.; mungara n.; sarasvathi v.,"lecture notes of the institute for computer sciences, social-informatics and telecommunications engineering",scopus,0,,,Q4,quartile,excluded,excluded
3308,2025,making a real-time iot network intrusion-detection system (inids) using a realistic bot–iot dataset with multiple machine-learning classifiers,ashraf j.; raza g.m.; kim b.-s.; wahid a.; kim h.-y.,applied sciences (switzerland),scopus,0,,,Q2,quartile,excluded,excluded
3310,2025,adaptive semi-supervised algorithm for intrusion detection and unknown attack identification,li m.; luo l.; xiao k.; wang g.; wang y.,applied sciences (switzerland),scopus,0,,,Q2,quartile,excluded,excluded
3312,2025,leveraging meta-learning for enhanced false data injection detection in smart grids: the onf-ml approach,pourshirazi m.; simab m.; mirzaee a.; fani b.,iet renewable power generation,scopus,0,,,Q2,quartile,excluded,excluded
3314,2025,adversarially robust federated deep learning models for intrusion detection in iot,ennaji e.m.; hajla s.e.; maleh y.; mounir s.,indonesian journal of electrical engineering and computer science,scopus,0,,,Q3,quartile,excluded,excluded
3318,2025,explainable and perturbation-resilient model for cyber-threat detection in industrial control systems networks,izuazu u.u.; nwakanma c.i.; kim d.-s.; lee j.m.,discover internet of things,scopus,0,0,,,h5-index,excluded,excluded
3319,2025,big data with machine learning enabled intrusion detection with honeypot intelligence system on apache flink (bdml-idhis),mudgal a.; bhatia s.,journal of computer virology and hacking techniques,scopus,0,,,Q2,quartile,excluded,excluded
3321,2025,privacy-preserving intrusion detection using fedsplit learning,abid m.; benkaddour m.k.; benouis m.,lecture notes in networks and systems,scopus,0,,,Q4,quartile,excluded,excluded
3325,2025,deep learning for intrusion detection in iot networks,selem m.; jemili f.; korbaa o.,peer-to-peer networking and applications,scopus,3,,inf,Q2,quartile,excluded,excluded
3332,2025,enhancing robustness in nids via coverage guided fuzzing and adversarial training,rhee j.y.; park l.h.; kwon t.,lecture notes in computer science,scopus,0,,,Q2,quartile,excluded,excluded
3333,2025,from vulnerability to defense: the role of large language models in enhancing cybersecurity,kasri w.; himeur y.; alkhazaleh h.a.; tarapiah s.; atalla s.; mansoor w.; al-ahmad h.,computation,scopus,6,,inf,Q2,quartile,excluded,excluded
3339,2025,machine learning-envisioned malware attack detection mechanism for edge computing-based networks,bhutani p.; thapliyal s.; wazid m.; giri d.; mishra a.k.; singh d.p.,lecture notes in networks and systems,scopus,0,,,Q4,quartile,excluded,excluded
3340,2025,new continual federated learning system for intrusion detection in sdn-based edge computing,chetouane a.; karoui k.,concurrency computation practice and experience,scopus,1,,inf,Q2,quartile,excluded,excluded
3342,2025,enhancing accuracy through ensemble based machine learning for intrusion detection and privacy preservation over the network of smart cities,uppal m.; gulzar y.; gupta d.; uppal j.; kumar m.; saini s.,discover internet of things,scopus,0,0,,,h5-index,excluded,excluded
3343,2025,securing fog-enabled iot: federated learning and generative adversarial networks for intrusion detection,lei t.,telecommunication systems,scopus,0,,-inf,Q2,quartile,excluded,excluded
3344,2025,hcrp-osd: fine-grained open-set intrusion detection based on hybrid convolution and adversarial reciprocal points learning,cai n.; jiang y.; zhang h.; yang z.; zhong l.; chen q.,concurrency computation practice and experience,scopus,0,,,Q2,quartile,excluded,excluded
3345,2025,a review of deep learning applications in intrusion detection systems: overcoming challenges in spatiotemporal feature extraction and data imbalance,zhang y.; muniyandi r.c.; qamar f.,applied sciences (switzerland),scopus,0,,,Q2,quartile,excluded,excluded
3347,2025,advancements in training and deployment strategies for ai-based intrusion detection systems in iot: a systematic literature review,mallidi s.k.r.; ramisetty r.r.,discover internet of things,scopus,1,0,inf,,h5-index,excluded,excluded
3348,2025,investigating the transferability of evasion attacks in network intrusion detection systems considering domain-specific constraints,mbow m.; roman r.; seal a.; wang k.i.-k.; mohanty s.k.; sakurai k.,lecture notes in computer science,scopus,0,,,Q2,quartile,excluded,excluded
3349,2025,enhanced hybrid deep learning models-based anomaly detection method for two-stage binary and multi-class classification of attacks in intrusion detection systems,kamal h.; mashaly m.,algorithms,scopus,2,,inf,Q2,quartile,excluded,excluded
3354,2025,a comprehensive survey on deep learning-based intrusion detection systems in internet of things (iot),al-haija q.a.; droos a.,expert systems,scopus,4,,inf,Q2,quartile,excluded,excluded
3362,2025,detection and analysis of cyber-attacks on iot network devices,adamu b.z.; kilincer i.f.; ertam f.,lecture notes in networks and systems,scopus,0,,,Q4,quartile,excluded,excluded
3367,2025,cascaded intrusion detection system using machine learning,ahamed m.k.u.; karim a.,systems and soft computing,scopus,1,,inf,Q3,quartile,excluded,excluded
3371,2025,adaptive machine learning-based intrusion detection systems for iot era,vadisetty r.,lecture notes in networks and systems,scopus,11,,inf,Q4,quartile,excluded,excluded
3376,2025,performance analysis of machine learning classifiers on cicids2017 dataset,reddy p.m.; upadhyay l.; rakesh l.,lecture notes in electrical engineering,scopus,0,,,Q4,quartile,excluded,excluded
3378,2025,auction-based optimization with machine learning for cyber threat detection and classification model,alqahtani h.,lecture notes in networks and systems,scopus,0,,,Q4,quartile,excluded,excluded
3381,2025,deep learning architectures for automated threat detection and mitigation in modern cyber security systems,gowdham c.; deshmukh m.; harika p.l.; saqib m.; barboza-sanchez l.j.,journal of information systems engineering and management,scopus,0,,,Q4,quartile,excluded,excluded
3385,2025,conflow: contrast network flow improving class-imbalanced learning in network intrusion detection,liu l.; wang p.; ruan j.; lin j.; hu j.,"lecture notes of the institute for computer sciences, social-informatics and telecommunications engineering",scopus,7,,inf,Q4,quartile,excluded,excluded
3386,2025,malicious attack detection using deep learning in iot network,srivastava a.; narayanan v.a.; sumesh a.k.,lecture notes in electrical engineering,scopus,0,,,Q4,quartile,excluded,excluded
3387,2025,"evaluating the effectiveness of machine learning, deep learning, and evolutionary algorithms in intrusion detection systems",anandpwar w.; barhate s.; dhore m.,lecture notes in electrical engineering,scopus,0,,,Q4,quartile,excluded,excluded
3388,2025,an analysis of ml-based intelligent ids for wireless sensor networks,dhengre s.g.; sayyad s.f.,lecture notes in electrical engineering,scopus,1,,inf,Q4,quartile,excluded,excluded
3390,2025,masqueradegan-gp: a generative adversarial network framework for evading black-box intrusion detection systems,dong b.; wang h.; luo r.,internet technology letters,scopus,0,,,Q3,quartile,excluded,excluded
3391,2025,ai techniques for automated penetration testing in mqtt networks: a literature investigation,alencar r.c.; fernandes b.j.t.; lima p.h.e.s.; da silva c.m.r.,international journal of computers and applications,scopus,0,,,Q2,quartile,excluded,excluded
3392,2025,an investigation into the performance of non-contrastive self-supervised learning methods for network intrusion detection,fard h.; schalau t.; wunder g.,lecture notes in computer science,scopus,0,,,Q2,quartile,excluded,excluded
3393,2025,dcnn-bigru: a proficient hybrid classifier for reliable intrusion detection and prevention: hybrid approach,sharma n.; nihalani n.,international journal of industrial engineering : theory applications and practice,scopus,0,,,Q3,quartile,excluded,excluded
3394,2025,guardev: guided unified adaptive response for defending electric vehicles,mondal k.k.; das d.,lecture notes in computer science,scopus,0,,,Q2,quartile,excluded,excluded
3395,2025,enhancing iot security: hybrid machine learning approach for iot attack detection,panthakkan a.; m anzar s.; j. m. shehada d.; mansoor w.; al ahmad h.,lecture notes in computer science,scopus,0,,,Q2,quartile,excluded,excluded
3397,2025,fedmade: robust federated learning for intrusion detection in iot networks using a dynamic aggregation method,sun s.; sharma p.; nwodo k.; stavrou a.; wang h.,lecture notes in computer science,scopus,3,,inf,Q2,quartile,excluded,excluded
3400,2025,a systematic review paper on attack detection systems in internet of things environment,kant u.; kumar v.,lecture notes in networks and systems,scopus,0,,,Q4,quartile,excluded,excluded
3402,2025,securing networks: a deep learning approach with explainable ai (xai) and federated learning for intrusion detection,fatema k.; anannya m.; dey s.k.; su c.; mazumder r.,lecture notes in computer science,scopus,2,,inf,Q2,quartile,excluded,excluded
3403,2025,an ensemble system for machine learning iot intrusion detection based on enhanced artificial hummingbird algorithm,shi l.; yang q.; gao l.; ge h.,journal of supercomputing,scopus,2,,inf,Q2,quartile,excluded,excluded
3404,2025,iot guardian: an intelligent framework for multi-class intrusion detection with machine learning,panthakkan a.; sagherji l.; alshehabi m.; shehada d.j.m.; mansoor w.,lecture notes in electrical engineering,scopus,2,,inf,Q4,quartile,excluded,excluded
3409,2025,an enhanced intrusion detection method combined with contrastive federated learning,ge y.; gao y.; li x.; cai b.; xi j.; han q.; liang y.,lecture notes in computer science,scopus,0,,,Q2,quartile,excluded,excluded
3410,2025,enhancing cybersecurity and privacy protection for cloud computing-assisted vehicular network of autonomous electric vehicles: applications of machine learning,yang t.; sun r.; rathore r.s.; baig i.,world electric vehicle journal,scopus,3,,inf,Q2,quartile,excluded,excluded
3415,2025,a hybrid machine learning approach for feature selection in designing intrusion detection systems (ids) model for distributed computing networks,pourardebil khah y.; hosseini shirvani m.; motameni h.,journal of supercomputing,scopus,0,,,Q2,quartile,excluded,excluded
3416,2025,enhanced bayesian network classifier for intrusion detection: integrating semi-lazy learning and multi-conditional entropy,liu y.; wu q.; zhang x.,proceedings of spie - the international society for optical engineering,scopus,0,,,-,quartile,excluded,excluded
3418,2025,optimizing feature selection in intrusion detection systems using a genetic algorithm with stochastic universal sampling,akula r.; kumar g.n.,international journal of advanced computer science and applications,scopus,0,,,Q3,quartile,excluded,excluded
3419,2025,future-proofed intrusion detection for internet of things with machine learning,adeyemi t.; ngobigha f.; ez-zizi a.,ieee international conference on ai in cybersecurity (icaic),scopus,0,0,,,h5-index,excluded,excluded
3422,2025,analyzing artificial intelligence based intrusion detection system in detecting ddos attack,kurra s.s.; rayana l.; yoosuf m.s.,"smart innovation, systems and technologies",scopus,0,,,Q4,quartile,excluded,excluded
3425,2025,ddos attack autonomous detection model based on multi-strategy integrate zebra optimization algorithm,li c.; wang x.; zhang q.; liang j.; zhang a.,"computers, materials and continua",scopus,1,,inf,Q2,quartile,excluded,excluded
3429,2025,detecting cyber and physical attacks against mobile robots using machine learning: an empirical study,nyusti l.; chockalingam s.; bours p.; bodal t.,lecture notes in computer science,scopus,0,,,Q2,quartile,excluded,excluded
3432,2025,sophon ids: mitigating the effectiveness of gan-based adversarial attacks via tailored misinformation,liu z.; ye q.; cui f.,lecture notes in computer science,scopus,0,,,Q2,quartile,excluded,excluded
3433,2025,a hybrid feature selection and aggregation strategy-based stacking ensemble technique for network intrusion detection,huang y.; chen g.; gou j.; fan z.; liao y.,applied intelligence,scopus,3,,inf,Q2,quartile,excluded,excluded
3435,2025,advancing machine learning and deep learning techniques for predictive analytics in cyber security and data science applications,kodali r.k.; kumar s.; inumula k.m.; ponce l.a.h.,journal of information systems engineering and management,scopus,229,,inf,Q4,quartile,excluded,excluded
3436,2025,predicting next phases of multi-stage network attacks: a comparative study of statistical and deep-learning models,severín a.; canales c.; torres r.; roudergue c.; salas r.,lecture notes in computer science,scopus,0,,,Q2,quartile,excluded,excluded
3441,2025,a robust security detection strategy for next generation iot networks,assmi h.; guezzaz a.; benkirane s.; azrour m.; jabbour s.; innab n.; alabdulatif a.,"computers, materials and continua",scopus,0,,,Q2,quartile,excluded,excluded
3444,2025,prevention of attacks on spanning tree protocol,adhikari m.s.; gupta r.; raj d.; astya r.; ather d.; agrawal a.,lecture notes in networks and systems,scopus,0,,,Q4,quartile,excluded,excluded
3446,2025,application of multidimensional data analysis in network intrusion detection system,xin j.,international journal of high speed electronics and systems,scopus,0,,,Q4,quartile,excluded,excluded
3449,2025,federated learning based intrusion detection system for healthcare domain,talha reyaz m.a.; vanitha v.; rajathi n.,lecture notes in electrical engineering,scopus,0,,,Q4,quartile,excluded,excluded
3452,2025,"wgan-dl-ids: an efficient framework for intrusion detection system using wgan, random forest, and deep learning approaches",gul s.; arshad s.; saeed s.m.u.; akram a.; azam m.a.,computers,scopus,1,,inf,Q2,quartile,excluded,excluded
3454,2025,uarc:unsupervised anomalous traffic detection with improved u-shaped autoencoder and retnet based multi-clustering,xie y.; chen k.; li s.; li b.; zhang n.,lecture notes in computer science,scopus,0,,,Q2,quartile,excluded,excluded
3455,2025,xi2s-ids: an explainable intelligent 2-stage intrusion detection system,mahmoud m.m.; youssef y.o.; abdel-hamid a.a.,future internet,scopus,3,,inf,Q2,quartile,excluded,excluded
3456,2025,uad-dpl: an unknown encrypted attack detection method based on deep prototype learning,chen l.-c.; gao s.; liu b.-x.; zhang x.-y.,lecture notes in computer science,scopus,0,,,Q2,quartile,excluded,excluded
3458,2025,artificial bee colony optimization techniques' utilization for intrusion detection systems' analysis,tokgoz e.,ieee international conference on ai in cybersecurity (icaic),scopus,0,0,,,h5-index,excluded,excluded
3459,2025,enhancing open-set recognition with global feature representation,ping g.,lecture notes in computer science,scopus,0,,,Q2,quartile,excluded,excluded
3461,2025,federated learning-based misbehavior classification system for vanet intrusion detection,gurjar d.; grover j.; kheterpal v.; vasilakos a.,journal of intelligent information systems,scopus,1,,inf,Q2,quartile,excluded,excluded
3464,2025,role of explainable artificial intelligence approaches in cybersecurity,bawane n.; nandan d.,lecture notes in electrical engineering,scopus,0,,,Q4,quartile,excluded,excluded
3467,2024,overcoming class imbalance in network intrusion detection: a gaussian mixture model and adasyn augmented deep learning framework,chen x.; gong z.; huang d.; jiang n.; zhang y.,acm international conference proceeding series,scopus,1,,1,-,quartile,excluded,excluded
3468,2024,performance analysis of anomaly-based network intrusion detection using feature selection and machine learning techniques,seniaray s.; jindal r.,wireless personal communications,scopus,4,,4,Q2,quartile,excluded,excluded
3471,2025,sc-wgan: gan-based oversampling method for network intrusion detection,bai w.; wang k.; chen k.; li s.; li b.; zhang n.,lecture notes in computer science,scopus,0,,,Q2,quartile,excluded,excluded
3472,2024,srfe: a stepwise recursive feature elimination approach for network intrusion detection systems,qasem a.a.; qutqut m.h.; alhaj f.; kitana a.,peer-to-peer networking and applications,scopus,2,,2,Q2,quartile,excluded,excluded
3473,2025,classify me correctly if you can: evaluating adversarial machine learning threats in nids,rusch n.; akbarfam a.j.; maleki h.; agrawal g.; dorai g.,"lecture notes of the institute for computer sciences, social-informatics and telecommunications engineering",scopus,0,,,Q4,quartile,excluded,excluded
3475,2024,vqcnn: variational quantum convolutional neural networks based on quantum filters and fully connected layers,qi h.; wang j.; cui y.,computer journal,scopus,1,,1,Q2,quartile,excluded,excluded
3476,2024,unraveling the potential: a systematic review and performance evaluation of data-driven network anomaly detection techniques,sharma n.; arora b.,international journal of pattern recognition and artificial intelligence,scopus,0,,0,Q3,quartile,excluded,excluded
3478,2024,an improved federated transfer learning model for intrusion detection in edge computing empowered wireless sensor networks,raja l.; sakthi g.; vimalnath s.; subramaniam g.,concurrency computation practice and experience,scopus,2,,2,Q2,quartile,excluded,excluded
3479,2024,a systematic study of adversarial attacks against network intrusion detection systems,sharma s.; chen z.,electronics (switzerland),scopus,0,,0,Q2,quartile,excluded,excluded
3484,2024,a hybrid approach for efficient feature selection in anomaly intrusion detection for iot networks,ayad a.g.; sakr n.a.; hikal n.a.,journal of supercomputing,scopus,12,,12,Q2,quartile,excluded,excluded
3485,2024,research on intrusion detection model based on optimized bayesian edge network,deng c.; shi h.; guo x.,acm international conference proceeding series,scopus,0,,0,-,quartile,excluded,excluded
3486,2024,leveraging optuna for hyperparameter tuning in gans: a novel solution for class imbalance in iot datasets,mouiti m.; el hariri a.; lazaar m.,engineering research express,scopus,1,,1,Q3,quartile,excluded,excluded
3487,2024,"exploring machine learning methods for intrusion detection system: a deep dive into techniques, datasets, and persistent challenges",basha s.j.; veeraiah d.; lingamgunta s.,journal of theoretical and applied information technology,scopus,0,,0,Q4,quartile,excluded,excluded
3492,2024,enhancing iot network security using feature selection for intrusion detection systems,almohaimeed m.; albalwy f.,applied sciences (switzerland),scopus,1,,1,Q2,quartile,excluded,excluded
3494,2024,enhancing intrusion detection in next-generation networks based on a multi-agent game-theoretic framework,lakshminarayana s.k.; basarkod p.i.,iaes international journal of artificial intelligence,scopus,17,,17,Q3,quartile,excluded,excluded
3495,2024,enhancing intrusion detection systems with dimensionality reduction and multi-stacking ensemble techniques,alsaffar a.m.; nouri-baygi m.; zolbanin h.,algorithms,scopus,1,,1,Q2,quartile,excluded,excluded
3499,2024,dualad: dual adversarial network for image anomaly detection⋆,wan y.; feng a.,iet computer vision,scopus,0,,0,Q3,quartile,excluded,excluded
3502,2024,building an intrusion detection system on unsw-nb15: reducing the margin of error to deal with data overlap and imbalance,zoghi z.; serpen g.,concurrency computation practice and experience,scopus,0,,0,Q2,quartile,excluded,excluded
3506,2024,federated learning-assisted coati deep learning-based model for intrusion detection in manet,hussain s.f.m.; fathima s.m.h.s.s.,international journal of computational intelligence systems,scopus,0,,0,Q2,quartile,excluded,excluded
3507,2024,machine learning-based methodologies for cyber-attacks and network traffic monitoring: a review and insights,genuario f.; santoro g.; giliberti m.; bello s.; zazzera e.; impedovo d.,information (switzerland),scopus,1,,1,Q2,quartile,excluded,excluded
3509,2024,a novel reinforcement learning-based hybrid intrusion detection system on fog-to-cloud computing,najafli s.; toroghi haghighat a.; karasfi b.,journal of supercomputing,scopus,3,,3,Q2,quartile,excluded,excluded
3515,2024,novel multi-class network intrusion detection mechanism combining rus and gan with dynamically adjusted data balancing strategy,fong j.-y.; wang c.-h.,journal of information science and engineering,scopus,0,,0,Q3,quartile,excluded,excluded
3516,2024,a comprehensive classification approach by integrating principal component analysis and support vector machines for advanced intrusion detection systems,pavithra c.; saradha m.,sn computer science,scopus,0,,0,Q2,quartile,excluded,excluded
3517,2025,lightweight intrusion detection for iot systems using artificial neural networks,saleh r.a.a.; al-awami l.; ghaleb m.; abudaqa a.a.,"lecture notes of the institute for computer sciences, social-informatics and telecommunications engineering",scopus,0,,,Q4,quartile,excluded,excluded
3520,2024,improved robust adversarial model against evasion attacks on intrusion detection systems,anaedevha r.n.; trofimov a.g.,optical memory and neural networks (information optics),scopus,0,,0,Q4,quartile,excluded,excluded
3521,2024,deep reinforcement learning-based adversarial attack and defense in industrial control systems,kim m.-s.,mathematics,scopus,0,,0,Q2,quartile,excluded,excluded
3522,2024,intrusion detection framework for can networks based on evidence deep learning; [基于证据深度学习的 can 网络入侵检测框架],shi q.; li z.; cheng t.; zhang q.; wang w.,qiche gongcheng/automotive engineering,scopus,0,,0,Q3,quartile,excluded,excluded
3523,2024,data mining approach for evil twin attack identification in wi-fi networks,banakh r.; nyemkova e.; justice c.; piskozub a.; lakh y.,data,scopus,0,,0,Q2,quartile,excluded,excluded
