workbook_record_id,year,title,author_list,venue,engine,citation_count,h5_index,mean_citation,quartile,quality_signal_available,title_stage_decision,abstract_keyword_stage_decision,post_abstract_decision,quality_decision,survey_decision,nids_scope_decision,access_decision,selected_for_detailed_review,retained_for_taxonomy_mapping,taxonomy_mapping_status,included_in_final_primary_corpus,source_sheet
1369,2024,fast anomalous traffic detection system for secure vehicular communications,q. a. al-haija; a. a. alsulami,intelligent and converged networks,ieee,1,,1,Q1,quartile,exclude,not_reviewed_at_this_stage,exclude,not_reviewed_at_this_stage,not_reviewed_at_this_stage,not_reviewed_at_this_stage,not_reviewed_at_this_stage,no,no,not_selected_for_taxonomy_mapping,no,journals
1373,2022,deep generative models in the industrial internet of things: a survey,s. de; m. bermudez-edo; h. xu; z. cai,ieee transactions on industrial informatics,ieee,68,114,22.666666666666671,Q1,h5-index+quartile,exclude,not_reviewed_at_this_stage,exclude,not_reviewed_at_this_stage,not_reviewed_at_this_stage,not_reviewed_at_this_stage,not_reviewed_at_this_stage,no,no,not_selected_for_taxonomy_mapping,no,journals
1375,2022,a cost-sensitive deep learning-based approach for network traffic classification,a. telikani; a. h. gandomi; k. -k. r. choo; j. shen,ieee transactions on network and service management,ieee,55,50,18.333333333333329,Q1,h5-index+quartile,exclude,not_reviewed_at_this_stage,exclude,not_reviewed_at_this_stage,not_reviewed_at_this_stage,not_reviewed_at_this_stage,not_reviewed_at_this_stage,no,no,not_selected_for_taxonomy_mapping,no,journals
1381,2024,incremental update intrusion detection for industry 5.0 security: a graph attention network-enabled approach,y. wu; l. nie; x. xiong; b. sadoun; l. yang; z. ning,ieee transactions on consumer electronics,ieee,4,,4,Q1,quartile,exclude,not_reviewed_at_this_stage,exclude,not_reviewed_at_this_stage,not_reviewed_at_this_stage,not_reviewed_at_this_stage,not_reviewed_at_this_stage,no,no,not_selected_for_taxonomy_mapping,no,journals
1383,2023,"edge learning for 6g-enabled internet of things: a comprehensive survey of vulnerabilities, datasets, and defenses",m. a. ferrag; o. friha; b. kantarci; n. tihanyi; l. cordeiro; m. debbah; d. hamouda; m. al-hawawreh; k. -k. r. choo,ieee communications surveys and tutorials,ieee,59,156,29.5,Q1,h5-index+quartile,exclude,not_reviewed_at_this_stage,exclude,not_reviewed_at_this_stage,not_reviewed_at_this_stage,not_reviewed_at_this_stage,not_reviewed_at_this_stage,no,no,not_selected_for_taxonomy_mapping,no,journals
1387,2024,"advanced deep learning models for 6g: overview, opportunities, and challenges",l. jiao; y. shao; l. sun; f. liu; s. yang; w. ma; l. li; x. liu; b. hou; x. zhang; r. shang; y. li; s. wang; x. tang; y. guo,ieee access,ieee,18,164,18,Q1,h5-index+quartile,exclude,not_reviewed_at_this_stage,exclude,not_reviewed_at_this_stage,not_reviewed_at_this_stage,not_reviewed_at_this_stage,not_reviewed_at_this_stage,no,no,not_selected_for_taxonomy_mapping,no,journals
1388,2024,analysis of financial data risk and network information security by blockchain technology and edge computing,s. liu; c. wang; y. zhou,ieee transactions on engineering management,ieee,5,33,5,Q1,h5-index+quartile,exclude,not_reviewed_at_this_stage,exclude,not_reviewed_at_this_stage,not_reviewed_at_this_stage,not_reviewed_at_this_stage,not_reviewed_at_this_stage,no,no,not_selected_for_taxonomy_mapping,no,journals
1399,2024,control system level intrusion detection on j1939 heavy-duty vehicle buses,c. jichici; a. berdich; a. musuroi; b. groza,ieee transactions on industrial informatics,ieee,9,114,9,Q1,h5-index+quartile,exclude,not_reviewed_at_this_stage,exclude,not_reviewed_at_this_stage,not_reviewed_at_this_stage,not_reviewed_at_this_stage,not_reviewed_at_this_stage,no,no,not_selected_for_taxonomy_mapping,no,journals
1400,2025,mathematical modeling of cyberattack defense mechanism using hybrid transfer learning with snow ablation optimization algorithm in critical infrastructures,m. k. ishak,ieee access,ieee,0,164,,Q1,h5-index+quartile,exclude,not_reviewed_at_this_stage,exclude,not_reviewed_at_this_stage,not_reviewed_at_this_stage,not_reviewed_at_this_stage,not_reviewed_at_this_stage,no,no,not_selected_for_taxonomy_mapping,no,journals
1401,2025,transitioning from federated learning to quantum federated learning in internet of things: a comprehensive survey,c. qiao; m. li; y. liu; z. tian,ieee communications surveys and tutorials,ieee,16,156,inf,Q1,h5-index+quartile,exclude,not_reviewed_at_this_stage,exclude,not_reviewed_at_this_stage,not_reviewed_at_this_stage,not_reviewed_at_this_stage,not_reviewed_at_this_stage,no,no,not_selected_for_taxonomy_mapping,no,journals
1407,2024,iotsecut: uncertainty-based hybrid deep learning approach for superior iot security amidst evolving cyber threats,a. g. m. mengara; y. yoo; v. c. m. leung,ieee internet of things journal,ieee,15,122,15,Q1,h5-index+quartile,exclude,not_reviewed_at_this_stage,exclude,not_reviewed_at_this_stage,not_reviewed_at_this_stage,not_reviewed_at_this_stage,not_reviewed_at_this_stage,no,no,not_selected_for_taxonomy_mapping,no,journals
1411,2025,enhancing power grid reliability with machine learning and auxiliary classifier generative adversarial networks: a study on fault detection using the georgia electric system load dataset,h. u. r. siddiqui; r. brown; a. ali saleem; m. amjad raza; s. dudley,ieee access,ieee,0,164,,Q1,h5-index+quartile,exclude,not_reviewed_at_this_stage,exclude,not_reviewed_at_this_stage,not_reviewed_at_this_stage,not_reviewed_at_this_stage,not_reviewed_at_this_stage,no,no,not_selected_for_taxonomy_mapping,no,journals
1413,2025,optimizing secure ai lifecycle model management with innovative generative ai strategies,a. omran almagrabi; r. a. khan,ieee access,ieee,7,164,inf,Q1,h5-index+quartile,exclude,not_reviewed_at_this_stage,exclude,not_reviewed_at_this_stage,not_reviewed_at_this_stage,not_reviewed_at_this_stage,not_reviewed_at_this_stage,no,no,not_selected_for_taxonomy_mapping,no,journals
1418,2022,deep learning based attack detection for cyber-physical system cybersecurity: a survey,j. zhang; l. pan; q. -l. han; c. chen; s. wen; y. xiang,ieee/caa journal of automatica sinica,ieee,364,51,121.3333333333333,Q1,h5-index+quartile,maybe_include,exclude,exclude,not_reviewed_at_this_stage,not_reviewed_at_this_stage,not_reviewed_at_this_stage,not_reviewed_at_this_stage,no,no,not_selected_for_taxonomy_mapping,no,journals
1420,2024,cgaad: centrality- and graph-aware deep-learning model for detecting cyberattacks targeting industrial control systems in critical infrastructure,t. n. i. alrumaih; m. j. f. alenazi,ieee internet of things journal,ieee,5,122,5,Q1,h5-index+quartile,exclude,not_reviewed_at_this_stage,exclude,not_reviewed_at_this_stage,not_reviewed_at_this_stage,not_reviewed_at_this_stage,not_reviewed_at_this_stage,no,no,not_selected_for_taxonomy_mapping,no,journals
1428,2022,a flow-based anomaly detection approach with feature selection method against ddos attacks in sdns,m. s. e. sayed; n. -a. le-khac; m. a. azer; a. d. jurcut,ieee transactions on cognitive communications and networking,ieee,135,34,45,Q1,h5-index+quartile,exclude,not_reviewed_at_this_stage,exclude,not_reviewed_at_this_stage,not_reviewed_at_this_stage,not_reviewed_at_this_stage,not_reviewed_at_this_stage,no,no,not_selected_for_taxonomy_mapping,no,journals
1437,2024,a review of machine learning techniques for optical wireless communication in intelligent transport systems,t. sefako; f. yang; j. song; r. balmahoon; l. cheng,intelligent and converged networks,ieee,0,,0,Q1,quartile,exclude,not_reviewed_at_this_stage,exclude,not_reviewed_at_this_stage,not_reviewed_at_this_stage,not_reviewed_at_this_stage,not_reviewed_at_this_stage,no,no,not_selected_for_taxonomy_mapping,no,journals
1442,2024,bayesian gan-based false data injection attack detection in active distribution grids with ders,j. xie; a. rahman; w. sun,ieee transactions on smart grid,ieee,6,130,6,Q1,h5-index+quartile,exclude,not_reviewed_at_this_stage,exclude,not_reviewed_at_this_stage,not_reviewed_at_this_stage,not_reviewed_at_this_stage,not_reviewed_at_this_stage,no,no,not_selected_for_taxonomy_mapping,no,journals
1443,2024,the role of deep learning in advancing proactive cybersecurity measures for smart grid networks: a survey,n. abdi; a. albaseer; m. abdallah,ieee internet of things journal,ieee,22,122,22,Q1,h5-index+quartile,exclude,not_reviewed_at_this_stage,exclude,not_reviewed_at_this_stage,not_reviewed_at_this_stage,not_reviewed_at_this_stage,not_reviewed_at_this_stage,no,no,not_selected_for_taxonomy_mapping,no,journals
1457,2024,enhancing road safety and cybersecurity in traffic management systems: leveraging the potential of reinforcement learning,i. agarwal; a. singh; a. agarwal; s. mishra; s. k. satapathy; s. -b. cho; m. r. prusty; s. n. mohanty,ieee access,ieee,8,164,8,Q1,h5-index+quartile,exclude,not_reviewed_at_this_stage,exclude,not_reviewed_at_this_stage,not_reviewed_at_this_stage,not_reviewed_at_this_stage,not_reviewed_at_this_stage,no,no,not_selected_for_taxonomy_mapping,no,journals
1461,2024,you can glimpse but you cannot identify: protect iot devices from being fingerprinted,s. tan; s. yu; w. liu; d. he; s. chan,ieee transactions on dependable and secure computing,ieee,4,59,4,Q1,h5-index+quartile,exclude,not_reviewed_at_this_stage,exclude,not_reviewed_at_this_stage,not_reviewed_at_this_stage,not_reviewed_at_this_stage,not_reviewed_at_this_stage,no,no,not_selected_for_taxonomy_mapping,no,journals
1464,2023,mitfed: a privacy preserving collaborative network attack mitigation framework based on federated learning using sdn and blockchain,z. a. e. houda; a. s. hafid; l. khoukhi,ieee transactions on network science and engineering,ieee,90,36,45,Q1,h5-index+quartile,exclude,not_reviewed_at_this_stage,exclude,not_reviewed_at_this_stage,not_reviewed_at_this_stage,not_reviewed_at_this_stage,not_reviewed_at_this_stage,no,no,not_selected_for_taxonomy_mapping,no,journals
1470,2024,research on encrypted traffic detection based on key features,f. chen; j. bai; w. gao,ieee access,ieee,1,164,1,Q1,h5-index+quartile,exclude,not_reviewed_at_this_stage,exclude,not_reviewed_at_this_stage,not_reviewed_at_this_stage,not_reviewed_at_this_stage,not_reviewed_at_this_stage,no,no,not_selected_for_taxonomy_mapping,no,journals
1484,2024,overview of ddos attack detection in software-defined networks,h. wang; y. li,ieee access,ieee,11,164,11,Q1,h5-index+quartile,exclude,not_reviewed_at_this_stage,exclude,not_reviewed_at_this_stage,not_reviewed_at_this_stage,not_reviewed_at_this_stage,not_reviewed_at_this_stage,no,no,not_selected_for_taxonomy_mapping,no,journals
1487,2022,privacy-preserved cyberattack detection in industrial edge of things (ieot): a blockchain-orchestrated federated learning approach,m. abdel-basset; n. moustafa; h. hawash,ieee transactions on industrial informatics,ieee,46,114,15.33333333333333,Q1,h5-index+quartile,exclude,not_reviewed_at_this_stage,exclude,not_reviewed_at_this_stage,not_reviewed_at_this_stage,not_reviewed_at_this_stage,not_reviewed_at_this_stage,no,no,not_selected_for_taxonomy_mapping,no,journals
1489,2023,blockchain and deep learning for secure communication in digital twin empowered industrial iot network,p. kumar; r. kumar; a. kumar; a. a. franklin; s. garg; s. singh,ieee transactions on network science and engineering,ieee,78,36,39,Q1,h5-index+quartile,exclude,not_reviewed_at_this_stage,exclude,not_reviewed_at_this_stage,not_reviewed_at_this_stage,not_reviewed_at_this_stage,not_reviewed_at_this_stage,no,no,not_selected_for_taxonomy_mapping,no,journals
1490,2023,can-loc: spoofing detection and physical intrusion localization on an in-vehicle can bus based on deep features of voltage signals,e. levy; a. shabtai; b. groza; p. -s. murvay; y. elovici,ieee transactions on information forensics and security,ieee,22,92,11,Q1,h5-index+quartile,exclude,not_reviewed_at_this_stage,exclude,not_reviewed_at_this_stage,not_reviewed_at_this_stage,not_reviewed_at_this_stage,not_reviewed_at_this_stage,no,no,not_selected_for_taxonomy_mapping,no,journals
1491,2022,a generative approach to open set recognition using distance-based probabilistic anomaly augmentation,j. goodman; s. sarkani; t. mazzuchi,ieee access,ieee,6,164,2,Q1,h5-index+quartile,exclude,not_reviewed_at_this_stage,exclude,not_reviewed_at_this_stage,not_reviewed_at_this_stage,not_reviewed_at_this_stage,not_reviewed_at_this_stage,no,no,not_selected_for_taxonomy_mapping,no,journals
1494,2024,a robust covert attack strategy for a class of uncertain cyber-physical systems,x. li; p. zhang; h. dong,ieee transactions on automatic control,ieee,7,109,7,Q1,h5-index+quartile,exclude,not_reviewed_at_this_stage,exclude,not_reviewed_at_this_stage,not_reviewed_at_this_stage,not_reviewed_at_this_stage,not_reviewed_at_this_stage,no,no,not_selected_for_taxonomy_mapping,no,journals
1495,2024,anomaly detection algorithm of industrial internet of things data platform based on deep learning,x. li; c. xie; z. zhao; c. wang; h. yu,ieee transactions on green communications and networking,ieee,3,,3,Q1,quartile,exclude,not_reviewed_at_this_stage,exclude,not_reviewed_at_this_stage,not_reviewed_at_this_stage,not_reviewed_at_this_stage,not_reviewed_at_this_stage,no,no,not_selected_for_taxonomy_mapping,no,journals
1496,2023,efficient and lightweight convolutional networks for iot malware detection: a federated learning approach,m. abdel-basset; h. hawash; k. m. sallam; i. elgendi; k. munasinghe; a. jamalipour,ieee internet of things journal,ieee,29,122,14.5,Q1,h5-index+quartile,exclude,not_reviewed_at_this_stage,exclude,not_reviewed_at_this_stage,not_reviewed_at_this_stage,not_reviewed_at_this_stage,not_reviewed_at_this_stage,no,no,not_selected_for_taxonomy_mapping,no,journals
1504,2024,enhancing cloud-based inventory management: a hybrid blockchain approach with generative adversarial network and elliptic curve diffie helman techniques,r. r. irshad; z. hussain; i. hussain; s. hussain; e. asghar; i. m. alwayle; k. m. alalayah; a. yousif; a. ali,ieee access,ieee,5,164,5,Q1,h5-index+quartile,exclude,not_reviewed_at_this_stage,exclude,not_reviewed_at_this_stage,not_reviewed_at_this_stage,not_reviewed_at_this_stage,not_reviewed_at_this_stage,no,no,not_selected_for_taxonomy_mapping,no,journals
1508,2025,applications of generative ai (gai) for mobile and wireless networking: a survey,t. -h. vu; s. kumar jagatheesaperumal; m. -d. nguyen; n. van huynh; s. kim; q. -v. pham,ieee internet of things journal,ieee,17,122,inf,Q1,h5-index+quartile,exclude,not_reviewed_at_this_stage,exclude,not_reviewed_at_this_stage,not_reviewed_at_this_stage,not_reviewed_at_this_stage,not_reviewed_at_this_stage,no,no,not_selected_for_taxonomy_mapping,no,journals
1510,2024,deep learning-assisted security and privacy provisioning in the internet of medical things systems: a survey on recent advances,r. pakrooh; a. jabbari; c. fung,ieee access,ieee,9,164,9,Q1,h5-index+quartile,exclude,not_reviewed_at_this_stage,exclude,not_reviewed_at_this_stage,not_reviewed_at_this_stage,not_reviewed_at_this_stage,not_reviewed_at_this_stage,no,no,not_selected_for_taxonomy_mapping,no,journals
1513,2025,securing facts-based wide area damping controllers using modified conditional generative adversarial networks,m. b. vavdareh; m. ghafouri; a. ameli,ieee transactions on smart grid,ieee,1,130,inf,Q1,h5-index+quartile,exclude,not_reviewed_at_this_stage,exclude,not_reviewed_at_this_stage,not_reviewed_at_this_stage,not_reviewed_at_this_stage,not_reviewed_at_this_stage,no,no,not_selected_for_taxonomy_mapping,no,journals
1520,2024,adaptive optimal control via q-learning for multi-agent pursuit-evasion games,x. dong; h. zhang; z. ming,ieee transactions on circuits and systems ii: express briefs,ieee,7,,7,Q1,quartile,exclude,not_reviewed_at_this_stage,exclude,not_reviewed_at_this_stage,not_reviewed_at_this_stage,not_reviewed_at_this_stage,not_reviewed_at_this_stage,no,no,not_selected_for_taxonomy_mapping,no,journals
1536,2024,modified marine predators algorithm with deep learning-driven security solution for iot-assisted uav networks,s. a. babu; a. ranganath; m. m. goswami; t. gnanaprakasam; m. k. ishak,ieee access,ieee,1,164,1,Q1,h5-index+quartile,exclude,not_reviewed_at_this_stage,exclude,not_reviewed_at_this_stage,not_reviewed_at_this_stage,not_reviewed_at_this_stage,not_reviewed_at_this_stage,no,no,not_selected_for_taxonomy_mapping,no,journals
1541,2023,privacy-preserved generative network for trustworthy anomaly detection in smart grids: a federated semisupervised approach,m. abdel-basset; n. moustafa; h. hawash,ieee transactions on industrial informatics,ieee,47,114,23.5,Q1,h5-index+quartile,exclude,not_reviewed_at_this_stage,exclude,not_reviewed_at_this_stage,not_reviewed_at_this_stage,not_reviewed_at_this_stage,not_reviewed_at_this_stage,no,no,not_selected_for_taxonomy_mapping,no,journals
1542,2024,rec-def: a recommendation-based defence mechanism for privacy preservation in federated learning systems,c. sandeepa; b. siniarski; s. wang; m. liyanage,ieee transactions on consumer electronics,ieee,7,,7,Q1,quartile,exclude,not_reviewed_at_this_stage,exclude,not_reviewed_at_this_stage,not_reviewed_at_this_stage,not_reviewed_at_this_stage,not_reviewed_at_this_stage,no,no,not_selected_for_taxonomy_mapping,no,journals
1549,2024,blockchain-powered deep learning for internet of things with cloud-assisted secure smart home networks,f. f. alruwaili,ieee access,ieee,1,164,1,Q1,h5-index+quartile,exclude,not_reviewed_at_this_stage,exclude,not_reviewed_at_this_stage,not_reviewed_at_this_stage,not_reviewed_at_this_stage,not_reviewed_at_this_stage,no,no,not_selected_for_taxonomy_mapping,no,journals
1551,2022,data discretization and decision boundary data point analysis for unknown attack detection,g. -y. shin; d. -w. kim; m. -m. han,ieee access,ieee,7,164,2.333333333333333,Q1,h5-index+quartile,exclude,not_reviewed_at_this_stage,exclude,not_reviewed_at_this_stage,not_reviewed_at_this_stage,not_reviewed_at_this_stage,not_reviewed_at_this_stage,no,no,not_selected_for_taxonomy_mapping,no,journals
1554,2024,explainable ai for cyber-physical systems: issues and challenges,a. hoenig; k. roy; y. t. acquaah; s. yi; s. s. desai,ieee access,ieee,18,164,18,Q1,h5-index+quartile,exclude,not_reviewed_at_this_stage,exclude,not_reviewed_at_this_stage,not_reviewed_at_this_stage,not_reviewed_at_this_stage,not_reviewed_at_this_stage,no,no,not_selected_for_taxonomy_mapping,no,journals
1557,2023,optimist: lightweight and transparent ids with optimum placement strategy to mitigate mixed-rate ddos attacks in iot networks,p. bhale; d. r. chowdhury; s. biswas; s. nandi,ieee internet of things journal,ieee,29,122,14.5,Q1,h5-index+quartile,exclude,not_reviewed_at_this_stage,exclude,not_reviewed_at_this_stage,not_reviewed_at_this_stage,not_reviewed_at_this_stage,not_reviewed_at_this_stage,no,no,not_selected_for_taxonomy_mapping,no,journals
1558,2024,darknet traffic analysis: a systematic literature review,j. saleem; r. islam; m. z. islam,ieee access,ieee,13,164,13,Q1,h5-index+quartile,exclude,not_reviewed_at_this_stage,exclude,not_reviewed_at_this_stage,not_reviewed_at_this_stage,not_reviewed_at_this_stage,not_reviewed_at_this_stage,no,no,not_selected_for_taxonomy_mapping,no,journals
1561,2024,ande: detect the anonymity web traffic with comprehensive model,y. deng; t. peng; b. wang; g. wu,ieee transactions on network and service management,ieee,0,50,0,Q1,h5-index+quartile,exclude,not_reviewed_at_this_stage,exclude,not_reviewed_at_this_stage,not_reviewed_at_this_stage,not_reviewed_at_this_stage,not_reviewed_at_this_stage,no,no,not_selected_for_taxonomy_mapping,no,journals
1565,2024,rank: ai-assisted end-to-end architecture for detecting persistent attacks in enterprise networks,h. m. soliman; d. sovilj; g. salmon; m. rao; n. mayya,ieee transactions on dependable and secure computing,ieee,9,59,9,Q1,h5-index+quartile,exclude,not_reviewed_at_this_stage,exclude,not_reviewed_at_this_stage,not_reviewed_at_this_stage,not_reviewed_at_this_stage,not_reviewed_at_this_stage,no,no,not_selected_for_taxonomy_mapping,no,journals
1574,2024,vadgan: an unsupervised gan framework for enhanced anomaly detection in connected and autonomous vehicles,d. s; r. r. shrivastava; p. narang; t. alladi; f. r. yu,ieee transactions on vehicular technology,ieee,3,120,3,Q1,h5-index+quartile,exclude,not_reviewed_at_this_stage,exclude,not_reviewed_at_this_stage,not_reviewed_at_this_stage,not_reviewed_at_this_stage,not_reviewed_at_this_stage,no,no,not_selected_for_taxonomy_mapping,no,journals
1580,2022,covert channel detection: machine learning approaches,m. a. elsadig; a. gafar,ieee access,ieee,46,164,15.33333333333333,Q1,h5-index+quartile,exclude,not_reviewed_at_this_stage,exclude,not_reviewed_at_this_stage,not_reviewed_at_this_stage,not_reviewed_at_this_stage,not_reviewed_at_this_stage,no,no,not_selected_for_taxonomy_mapping,no,journals
1581,2023,a region-based relay pursuit scheme for a pursuit–evasion game with a single evader and multiple pursuers,t. pan; y. yuan,"ieee transactions on systems, man, and cybernetics: systems",ieee,30,102,15,Q1,h5-index+quartile,exclude,not_reviewed_at_this_stage,exclude,not_reviewed_at_this_stage,not_reviewed_at_this_stage,not_reviewed_at_this_stage,not_reviewed_at_this_stage,no,no,not_selected_for_taxonomy_mapping,no,journals
1582,2024,a novel constructive unceasement conditional random field and dynamic bayesian network model for attack prediction on internet of vehicle,r. k. mahendran; s. rajendran; p. pandian; r. s. rathore; f. benedetto; r. h. jhaveri,ieee access,ieee,10,164,10,Q1,h5-index+quartile,exclude,not_reviewed_at_this_stage,exclude,not_reviewed_at_this_stage,not_reviewed_at_this_stage,not_reviewed_at_this_stage,not_reviewed_at_this_stage,no,no,not_selected_for_taxonomy_mapping,no,journals
1584,2024,ensemble voting for enhanced robustness in darknet traffic detection,v. shinde; k. singhal; a. almogren; v. dhanawat; v. karande; a. u. rehman,ieee access,ieee,4,164,4,Q1,h5-index+quartile,exclude,not_reviewed_at_this_stage,exclude,not_reviewed_at_this_stage,not_reviewed_at_this_stage,not_reviewed_at_this_stage,not_reviewed_at_this_stage,no,no,not_selected_for_taxonomy_mapping,no,journals
1589,2023,use of ensemble learning to detect buffer overflow exploitation,a. youssef; m. abdelrazek; c. karmakar,ieee access,ieee,5,164,2.5,Q1,h5-index+quartile,exclude,not_reviewed_at_this_stage,exclude,not_reviewed_at_this_stage,not_reviewed_at_this_stage,not_reviewed_at_this_stage,not_reviewed_at_this_stage,no,no,not_selected_for_taxonomy_mapping,no,journals
1591,2025,pursuit-evasion games of marine surface vessels using neural network-based control,x. guo; r. cui; w. yan,"ieee transactions on systems, man, and cybernetics: systems",ieee,8,102,inf,Q1,h5-index+quartile,exclude,not_reviewed_at_this_stage,exclude,not_reviewed_at_this_stage,not_reviewed_at_this_stage,not_reviewed_at_this_stage,not_reviewed_at_this_stage,no,no,not_selected_for_taxonomy_mapping,no,journals
1593,2023,untargeted poisoning attack detection in federated learning via behavior attestational,r. a. mallah; d. lópez; g. badu-marfo; b. farooq,ieee access,ieee,49,164,24.5,Q1,h5-index+quartile,exclude,not_reviewed_at_this_stage,exclude,not_reviewed_at_this_stage,not_reviewed_at_this_stage,not_reviewed_at_this_stage,not_reviewed_at_this_stage,no,no,not_selected_for_taxonomy_mapping,no,journals
1594,2023,secure industrial iot systems via rf fingerprinting under impaired channels with interference and noise,o. m. gul; m. kulhandjian; b. kantarci; a. touazi; c. ellement; c. d’amours,ieee access,ieee,32,164,16,Q1,h5-index+quartile,exclude,not_reviewed_at_this_stage,exclude,not_reviewed_at_this_stage,not_reviewed_at_this_stage,not_reviewed_at_this_stage,not_reviewed_at_this_stage,no,no,not_selected_for_taxonomy_mapping,no,journals
1599,2022,homogeneous learning: self-attention decentralized deep learning,y. sun; h. ochiai,ieee access,ieee,13,164,4.333333333333333,Q1,h5-index+quartile,exclude,not_reviewed_at_this_stage,exclude,not_reviewed_at_this_stage,not_reviewed_at_this_stage,not_reviewed_at_this_stage,not_reviewed_at_this_stage,no,no,not_selected_for_taxonomy_mapping,no,journals
1602,2023,dantd: a deep abnormal network traffic detection model for security of industrial internet of things using high-order features,g. shi; x. shen; f. xiao; y. he,ieee internet of things journal,ieee,45,122,22.5,Q1,h5-index+quartile,exclude,not_reviewed_at_this_stage,exclude,not_reviewed_at_this_stage,not_reviewed_at_this_stage,not_reviewed_at_this_stage,not_reviewed_at_this_stage,no,no,not_selected_for_taxonomy_mapping,no,journals
1607,2022,multiontology construction and application of threat model based on adversarial attack and defense under iso/iec 27032,x. hu; d. cheng; j. chen; x. jin; b. wu,ieee access,ieee,4,164,1.333333333333333,Q1,h5-index+quartile,exclude,not_reviewed_at_this_stage,exclude,not_reviewed_at_this_stage,not_reviewed_at_this_stage,not_reviewed_at_this_stage,not_reviewed_at_this_stage,no,no,not_selected_for_taxonomy_mapping,no,journals
1612,2023,optimal intermittent sensing for pursuit–evasion games,d. maity,ieee control systems letters,ieee,4,27,2,Q1,h5-index+quartile,exclude,not_reviewed_at_this_stage,exclude,not_reviewed_at_this_stage,not_reviewed_at_this_stage,not_reviewed_at_this_stage,not_reviewed_at_this_stage,no,no,not_selected_for_taxonomy_mapping,no,journals
