workbook_record_id,year,title,author_list,venue,engine,citation_count,h5_index,mean_citation,quartile,quality_signal_available,title_stage_decision,abstract_keyword_stage_decision,post_abstract_decision,quality_decision,survey_decision,nids_scope_decision,access_decision,selected_for_detailed_review,retained_for_taxonomy_mapping,taxonomy_mapping_status,included_in_final_primary_corpus,source_sheet
2242,2022,situation representation and strategic reasoning method of hybrid game system based on modified hybrid stochastic timed petri net,r. cao; h. yang; j. cui; l. hao; l. wang,ieee systems journal,ieee,1,74,0.33333333333333331,Q1,h5-index+quartile,exclude,not_reviewed_at_this_stage,exclude,not_reviewed_at_this_stage,not_reviewed_at_this_stage,not_reviewed_at_this_stage,not_reviewed_at_this_stage,no,no,not_selected_for_taxonomy_mapping,no,journals
2243,2022,crystal ball: from innovative attacks to attack effectiveness classifier,h. berger; c. hajaj; e. mariconti; a. dvir,ieee access,ieee,9,164,3,Q1,h5-index+quartile,exclude,not_reviewed_at_this_stage,exclude,not_reviewed_at_this_stage,not_reviewed_at_this_stage,not_reviewed_at_this_stage,not_reviewed_at_this_stage,no,no,not_selected_for_taxonomy_mapping,no,journals
2258,2023,parameter identification of a pn-guided incoming missile using an improved multiple-model mechanism,y. wang; j. wang; s. fan,ieee transactions on aerospace and electronic systems,ieee,10,,5,Q1,quartile,exclude,not_reviewed_at_this_stage,exclude,not_reviewed_at_this_stage,not_reviewed_at_this_stage,not_reviewed_at_this_stage,not_reviewed_at_this_stage,no,no,not_selected_for_taxonomy_mapping,no,journals
2259,2024,secure perception-driven control of mobile robots using chaotic encryption,x. zhang; z. yuan; s. xu; y. lu; m. zhu,ieee transactions on automatic control,ieee,4,109,4,Q1,h5-index+quartile,exclude,not_reviewed_at_this_stage,exclude,not_reviewed_at_this_stage,not_reviewed_at_this_stage,not_reviewed_at_this_stage,not_reviewed_at_this_stage,no,no,not_selected_for_taxonomy_mapping,no,journals
2269,2023,completely stealthy fdi attack against state estimation in networked control systems,y. liu; l. cheng,ieee transactions on circuits and systems ii: express briefs,ieee,16,,8,Q1,quartile,maybe_include,exclude,exclude,not_reviewed_at_this_stage,not_reviewed_at_this_stage,not_reviewed_at_this_stage,not_reviewed_at_this_stage,no,no,not_selected_for_taxonomy_mapping,no,journals
2270,2022,higher-order moment-based anomaly detection,v. renganathan; n. hashemi; j. ruths; t. h. summers,ieee control systems letters,ieee,16,27,5.333333333333333,Q1,h5-index+quartile,exclude,not_reviewed_at_this_stage,exclude,not_reviewed_at_this_stage,not_reviewed_at_this_stage,not_reviewed_at_this_stage,not_reviewed_at_this_stage,no,no,not_selected_for_taxonomy_mapping,no,journals
2282,2022,imposter attacks in energy market operation,s. d. roy; s. debbarma,ieee transactions on smart grid,ieee,6,130,2,Q1,h5-index+quartile,exclude,not_reviewed_at_this_stage,exclude,not_reviewed_at_this_stage,not_reviewed_at_this_stage,not_reviewed_at_this_stage,not_reviewed_at_this_stage,no,no,not_selected_for_taxonomy_mapping,no,journals
2316,2022,an isochron-based solution to the target defense game against a faster invader,h. fu; h. h. . -t. liu,ieee control systems letters,ieee,10,27,3.333333333333333,Q1,h5-index+quartile,exclude,not_reviewed_at_this_stage,exclude,not_reviewed_at_this_stage,not_reviewed_at_this_stage,not_reviewed_at_this_stage,not_reviewed_at_this_stage,no,no,not_selected_for_taxonomy_mapping,no,journals
2375,2023,cyber attacks via consumer electronics: studying the threat of covert malware in smart and autonomous vehicles,m. sayad haghighi; f. farivar; a. jolfaei; a. b. asl; w. zhou,ieee transactions on consumer electronics,ieee,44,,22,Q1,quartile,exclude,not_reviewed_at_this_stage,exclude,not_reviewed_at_this_stage,not_reviewed_at_this_stage,not_reviewed_at_this_stage,not_reviewed_at_this_stage,no,no,not_selected_for_taxonomy_mapping,no,journals
2376,2022,rd-iwan: residual dense based imperceptible watermark attack network,c. wang; q. hao; s. xu; b. ma; z. xia; q. li; j. li; y. -q. shi,ieee transactions on circuits and systems for video technology,ieee,24,77,8,Q1,h5-index+quartile,maybe_include,exclude,exclude,not_reviewed_at_this_stage,not_reviewed_at_this_stage,not_reviewed_at_this_stage,not_reviewed_at_this_stage,no,no,not_selected_for_taxonomy_mapping,no,journals
2377,2023,detection and localization of stealthy cyberattacks in cyber-physical discrete event systems,r. fritz; p. zhang,ieee transactions on automatic control,ieee,25,109,12.5,Q1,h5-index+quartile,maybe_include,exclude,exclude,not_reviewed_at_this_stage,not_reviewed_at_this_stage,not_reviewed_at_this_stage,not_reviewed_at_this_stage,no,no,not_selected_for_taxonomy_mapping,no,journals
2378,2023,disarming attacks inside neural network models,r. dubin,ieee access,ieee,5,164,2.5,Q1,h5-index+quartile,exclude,not_reviewed_at_this_stage,exclude,not_reviewed_at_this_stage,not_reviewed_at_this_stage,not_reviewed_at_this_stage,not_reviewed_at_this_stage,no,no,not_selected_for_taxonomy_mapping,no,journals
2383,2022,how to secure distributed filters under sensor attacks,x. he; x. ren; h. sandberg; k. h. johansson,ieee transactions on automatic control,ieee,57,109,19,Q1,h5-index+quartile,exclude,not_reviewed_at_this_stage,exclude,not_reviewed_at_this_stage,not_reviewed_at_this_stage,not_reviewed_at_this_stage,not_reviewed_at_this_stage,no,no,not_selected_for_taxonomy_mapping,no,journals
2385,2023,attack detection for cyber-physical systems: a zonotopic approach,j. li; z. wang; y. shen; l. xie,ieee transactions on automatic control,ieee,35,109,17.5,Q1,h5-index+quartile,exclude,not_reviewed_at_this_stage,exclude,not_reviewed_at_this_stage,not_reviewed_at_this_stage,not_reviewed_at_this_stage,not_reviewed_at_this_stage,no,no,not_selected_for_taxonomy_mapping,no,journals
2386,2022,worst-case stealthy attacks on stochastic event-based state estimation,j. shang; h. yu; t. chen,ieee transactions on automatic control,ieee,27,109,9,Q1,h5-index+quartile,exclude,not_reviewed_at_this_stage,exclude,not_reviewed_at_this_stage,not_reviewed_at_this_stage,not_reviewed_at_this_stage,not_reviewed_at_this_stage,no,no,not_selected_for_taxonomy_mapping,no,journals
2387,2022,optimal stealthy linear attack on remote state estimation with side information,d. ye; b. yang; t. -y. zhang,ieee systems journal,ieee,22,74,7.333333333333333,Q1,h5-index+quartile,exclude,not_reviewed_at_this_stage,exclude,not_reviewed_at_this_stage,not_reviewed_at_this_stage,not_reviewed_at_this_stage,not_reviewed_at_this_stage,no,no,not_selected_for_taxonomy_mapping,no,journals
2388,2022,a gan-based data injection attack method on data-driven strategies in power systems,z. liu; q. wang; y. ye; y. tang,ieee transactions on smart grid,ieee,23,130,7.666666666666667,Q1,h5-index+quartile,maybe_include,exclude,exclude,not_reviewed_at_this_stage,not_reviewed_at_this_stage,not_reviewed_at_this_stage,not_reviewed_at_this_stage,no,no,not_selected_for_taxonomy_mapping,no,journals
2389,2023,the loft attack: overflowing sdn flow tables at a low rate,j. cao; m. xu; q. li; k. sun; y. yang,ieee/acm transactions on networking,ieee,19,65,9.5,Q1,h5-index+quartile,maybe_include,exclude,exclude,not_reviewed_at_this_stage,not_reviewed_at_this_stage,not_reviewed_at_this_stage,not_reviewed_at_this_stage,no,no,not_selected_for_taxonomy_mapping,no,journals
2391,2023,on information fusion in optimal linear fdi attacks against remote state estimation,j. zhou; j. shang; t. chen,ieee transactions on control of network systems,ieee,9,,4.5,Q1,quartile,exclude,not_reviewed_at_this_stage,exclude,not_reviewed_at_this_stage,not_reviewed_at_this_stage,not_reviewed_at_this_stage,not_reviewed_at_this_stage,no,no,not_selected_for_taxonomy_mapping,no,journals
2392,2024,optimal stealthy attacks with energy constraint against remote state estimation,x. liu; g. -h. yang,ieee transactions on cybernetics,ieee,8,,8,Q1,quartile,exclude,not_reviewed_at_this_stage,exclude,not_reviewed_at_this_stage,not_reviewed_at_this_stage,not_reviewed_at_this_stage,not_reviewed_at_this_stage,no,no,not_selected_for_taxonomy_mapping,no,journals
2393,2022,improved interval estimation method for cyber-physical systems under stealthy deception attacks,j. fan; j. huang; x. zhao,ieee transactions on signal and information processing over networks,ieee,13,,4.333333333333333,Q1,quartile,exclude,not_reviewed_at_this_stage,exclude,not_reviewed_at_this_stage,not_reviewed_at_this_stage,not_reviewed_at_this_stage,not_reviewed_at_this_stage,no,no,not_selected_for_taxonomy_mapping,no,journals
2395,2023,stealthy noise injection attacks against state estimation in interconnected systems,j. -r. huo; x. -j. li,ieee transactions on circuits and systems ii: express briefs,ieee,3,,1.5,Q1,quartile,maybe_include,exclude,exclude,not_reviewed_at_this_stage,not_reviewed_at_this_stage,not_reviewed_at_this_stage,not_reviewed_at_this_stage,no,no,not_selected_for_taxonomy_mapping,no,journals
2396,2024,hybrid stealthy attacks on stochastic event-based remote estimation under packet dropouts,z. lian; p. shi; c. p. lim; i. j. rudas; r. k. agarwal,ieee transactions on network science and engineering,ieee,3,36,3,Q1,h5-index+quartile,maybe_include,exclude,exclude,not_reviewed_at_this_stage,not_reviewed_at_this_stage,not_reviewed_at_this_stage,not_reviewed_at_this_stage,no,no,not_selected_for_taxonomy_mapping,no,journals
2397,2023,toward effective evaluation of cyber defense: threat based adversary emulation approach,a. b. ajmal; s. khan; m. alam; a. mehbodniya; j. webber; a. waheed,ieee access,ieee,14,164,7,Q1,h5-index+quartile,exclude,not_reviewed_at_this_stage,exclude,not_reviewed_at_this_stage,not_reviewed_at_this_stage,not_reviewed_at_this_stage,not_reviewed_at_this_stage,no,no,not_selected_for_taxonomy_mapping,no,journals
2398,2022,finite-horizon strictly stealthy deterministic attacks on cyber-physical systems,d. cheng; j. shang; t. chen,ieee control systems letters,ieee,6,27,2,Q1,h5-index+quartile,exclude,not_reviewed_at_this_stage,exclude,not_reviewed_at_this_stage,not_reviewed_at_this_stage,not_reviewed_at_this_stage,not_reviewed_at_this_stage,no,no,not_selected_for_taxonomy_mapping,no,journals
2400,2024,improved stealthy false data injection attacks in networked control systems,c. ning; z. xi,ieee systems journal,ieee,8,74,8,Q1,h5-index+quartile,maybe_include,exclude,exclude,not_reviewed_at_this_stage,not_reviewed_at_this_stage,not_reviewed_at_this_stage,not_reviewed_at_this_stage,no,no,not_selected_for_taxonomy_mapping,no,journals
2402,2024,robust data-driven adversarial false data injection attack detection method with deep q-network in power systems,x. ran; w. p. tay; c. h. t. lee,ieee transactions on industrial informatics,ieee,1,114,1,Q1,h5-index+quartile,maybe_include,exclude,exclude,not_reviewed_at_this_stage,not_reviewed_at_this_stage,not_reviewed_at_this_stage,not_reviewed_at_this_stage,no,no,not_selected_for_taxonomy_mapping,no,journals
2404,2024,security analysis for autonomous ground vehicle under stealthy sensor attacks,z. peng; y. zhang; g. wen; j. wang; t. huang,ieee transactions on vehicular technology,ieee,1,120,1,Q1,h5-index+quartile,exclude,not_reviewed_at_this_stage,exclude,not_reviewed_at_this_stage,not_reviewed_at_this_stage,not_reviewed_at_this_stage,not_reviewed_at_this_stage,no,no,not_selected_for_taxonomy_mapping,no,journals
2406,2025,detection of perfect stealthy attacks on cyber-physical systems subject to measurement quantizations: a watermark-based strategy,y. -a. wang; z. wang; l. zou; b. shen; h. dong,ieee/caa journal of automatica sinica,ieee,0,51,,Q1,h5-index+quartile,exclude,not_reviewed_at_this_stage,exclude,not_reviewed_at_this_stage,not_reviewed_at_this_stage,not_reviewed_at_this_stage,not_reviewed_at_this_stage,no,no,not_selected_for_taxonomy_mapping,no,journals
2409,2024,ensuring resilience against stealthy attacks on cyber-physical systems,p. griffioen; b. h. krogh; b. sinopoli,ieee transactions on automatic control,ieee,2,109,2,Q1,h5-index+quartile,exclude,not_reviewed_at_this_stage,exclude,not_reviewed_at_this_stage,not_reviewed_at_this_stage,not_reviewed_at_this_stage,not_reviewed_at_this_stage,no,no,not_selected_for_taxonomy_mapping,no,journals
2410,2022,secure control of multiagent systems against malicious attacks: a brief survey,w. he; w. xu; x. ge; q. -l. han; w. du; f. qian,ieee transactions on industrial informatics,ieee,205,114,68.333333333333329,Q1,h5-index+quartile,exclude,not_reviewed_at_this_stage,exclude,not_reviewed_at_this_stage,not_reviewed_at_this_stage,not_reviewed_at_this_stage,not_reviewed_at_this_stage,no,no,not_selected_for_taxonomy_mapping,no,journals
2411,2022,co-estimation of state and fdi attacks and attack compensation control for multi-area load frequency control systems under fdi and dos attacks,x. chen; s. hu; y. li; d. yue; c. dou; l. ding,ieee transactions on smart grid,ieee,97,130,32.333333333333343,Q1,h5-index+quartile,exclude,not_reviewed_at_this_stage,exclude,not_reviewed_at_this_stage,not_reviewed_at_this_stage,not_reviewed_at_this_stage,not_reviewed_at_this_stage,no,no,not_selected_for_taxonomy_mapping,no,journals
2412,2022,secure and personalized edge computing services in 6g heterogeneous vehicular networks,y. hui; n. cheng; z. su; y. huang; p. zhao; t. h. luan; c. li,ieee internet of things journal,ieee,73,122,24.333333333333329,Q1,h5-index+quartile,exclude,not_reviewed_at_this_stage,exclude,not_reviewed_at_this_stage,not_reviewed_at_this_stage,not_reviewed_at_this_stage,not_reviewed_at_this_stage,no,no,not_selected_for_taxonomy_mapping,no,journals
2413,2022,state estimation under joint false data injection attacks: dealing with constraints and insecurity,w. xu; z. wang; l. hu; j. kurths,ieee transactions on automatic control,ieee,63,109,21,Q1,h5-index+quartile,exclude,not_reviewed_at_this_stage,exclude,not_reviewed_at_this_stage,not_reviewed_at_this_stage,not_reviewed_at_this_stage,not_reviewed_at_this_stage,no,no,not_selected_for_taxonomy_mapping,no,journals
2414,2022,worst-case stealthy innovation-based linear attacks on remote state estimation under kullback–leibler divergence,j. shang; h. yu; t. chen,ieee transactions on automatic control,ieee,64,109,21.333333333333329,Q1,h5-index+quartile,exclude,not_reviewed_at_this_stage,exclude,not_reviewed_at_this_stage,not_reviewed_at_this_stage,not_reviewed_at_this_stage,not_reviewed_at_this_stage,no,no,not_selected_for_taxonomy_mapping,no,journals
2416,2023,cybersecurity of autonomous vehicles: a systematic literature review of adversarial attacks and defense models,m. girdhar; j. hong; j. moore,ieee open journal of vehicular technology,ieee,81,,40.5,Q1,quartile,exclude,not_reviewed_at_this_stage,exclude,not_reviewed_at_this_stage,not_reviewed_at_this_stage,not_reviewed_at_this_stage,not_reviewed_at_this_stage,no,no,not_selected_for_taxonomy_mapping,no,journals
2417,2023,"distributed energy resources cybersecurity outlook: vulnerabilities, attacks, impacts, and mitigations",i. zografopoulos; n. d. hatziargyriou; c. konstantinou,ieee systems journal,ieee,98,74,49,Q1,h5-index+quartile,exclude,not_reviewed_at_this_stage,exclude,not_reviewed_at_this_stage,not_reviewed_at_this_stage,not_reviewed_at_this_stage,not_reviewed_at_this_stage,no,no,not_selected_for_taxonomy_mapping,no,journals
2418,2023,resilient load frequency control of multi-area power systems under dos attacks,s. hu; x. ge; y. li; x. chen; x. xie; d. yue,ieee transactions on information forensics and security,ieee,39,92,19.5,Q1,h5-index+quartile,exclude,not_reviewed_at_this_stage,exclude,not_reviewed_at_this_stage,not_reviewed_at_this_stage,not_reviewed_at_this_stage,not_reviewed_at_this_stage,no,no,not_selected_for_taxonomy_mapping,no,journals
2419,2024,a secure federated learning framework for residential short-term load forecasting,m. a. husnoo; a. anwar; n. hosseinzadeh; s. n. islam; a. n. mahmood; r. doss,ieee transactions on smart grid,ieee,47,130,47,Q1,h5-index+quartile,exclude,not_reviewed_at_this_stage,exclude,not_reviewed_at_this_stage,not_reviewed_at_this_stage,not_reviewed_at_this_stage,not_reviewed_at_this_stage,no,no,not_selected_for_taxonomy_mapping,no,journals
2420,2022,flam-puf: a response–feedback-based lightweight anti-machine-learning-attack puf,l. wu; y. hu; k. zhang; w. li; x. xu; w. chang,ieee transactions on computer-aided design of integrated circuits and systems,ieee,40,51,13.33333333333333,Q1,h5-index+quartile,maybe_include,exclude,exclude,not_reviewed_at_this_stage,not_reviewed_at_this_stage,not_reviewed_at_this_stage,not_reviewed_at_this_stage,no,no,not_selected_for_taxonomy_mapping,no,journals
2421,2024,important-data-based dos attack mechanism and resilient h∞ filter design for networked t–s fuzzy systems,x. wang; e. tian; w. x. zheng; x. xie,ieee transactions on cybernetics,ieee,43,,43,Q1,quartile,exclude,not_reviewed_at_this_stage,exclude,not_reviewed_at_this_stage,not_reviewed_at_this_stage,not_reviewed_at_this_stage,not_reviewed_at_this_stage,no,no,not_selected_for_taxonomy_mapping,no,journals
2422,2023,stochastic data-based denial-of-service attack strategy design against remote state estimation in interval type-2 t–s fuzzy systems,m. fan; e. tian; x. -p. xie; d. yue; t. cao,ieee transactions on fuzzy systems,ieee,28,96,14,Q1,h5-index+quartile,exclude,not_reviewed_at_this_stage,exclude,not_reviewed_at_this_stage,not_reviewed_at_this_stage,not_reviewed_at_this_stage,not_reviewed_at_this_stage,no,no,not_selected_for_taxonomy_mapping,no,journals
2423,2023,false-data-injection-enabled network parameter modifications in power systems: attack and detection,c. liu; w. he; r. deng; y. -c. tian; w. du,ieee transactions on industrial informatics,ieee,24,114,12,Q1,h5-index+quartile,maybe_include,exclude,exclude,not_reviewed_at_this_stage,not_reviewed_at_this_stage,not_reviewed_at_this_stage,not_reviewed_at_this_stage,no,no,not_selected_for_taxonomy_mapping,no,journals
2424,2023,robust multi-robot active target tracking against sensing and communication attacks,l. zhou; v. kumar,ieee transactions on robotics,ieee,40,,20,Q1,quartile,exclude,not_reviewed_at_this_stage,exclude,not_reviewed_at_this_stage,not_reviewed_at_this_stage,not_reviewed_at_this_stage,not_reviewed_at_this_stage,no,no,not_selected_for_taxonomy_mapping,no,journals
2425,2023,a novel federated edge learning approach for detecting cyberattacks in iot infrastructures,s. abbas; a. a. hejaili; g. a. sampedro; m. abisado; a. s. almadhor; t. shahzad; k. ouahada,ieee access,ieee,32,164,16,Q1,h5-index+quartile,exclude,not_reviewed_at_this_stage,exclude,not_reviewed_at_this_stage,not_reviewed_at_this_stage,not_reviewed_at_this_stage,not_reviewed_at_this_stage,no,no,not_selected_for_taxonomy_mapping,no,journals
2426,2022,is it really easy to detect sybil attacks in c-its environments: a position paper,b. hammi; y. m. idir; s. zeadally; r. khatoun; j. nebhen,ieee transactions on intelligent transportation systems,ieee,26,107,8.6666666666666661,Q1,h5-index+quartile,exclude,not_reviewed_at_this_stage,exclude,not_reviewed_at_this_stage,not_reviewed_at_this_stage,not_reviewed_at_this_stage,not_reviewed_at_this_stage,no,no,not_selected_for_taxonomy_mapping,no,journals
2427,2022,security analysis for distributed iot-based industrial automation,v. lesi; z. jakovljevic; m. pajic,ieee transactions on automation science and engineering,ieee,32,62,10.66666666666667,Q1,h5-index+quartile,exclude,not_reviewed_at_this_stage,exclude,not_reviewed_at_this_stage,not_reviewed_at_this_stage,not_reviewed_at_this_stage,not_reviewed_at_this_stage,no,no,not_selected_for_taxonomy_mapping,no,journals
2428,2023,off-policy learning-based following control of cooperative autonomous vehicles under distributed attacks,y. xu; z. -g. wu; y. -j. pan,ieee transactions on intelligent transportation systems,ieee,22,107,11,Q1,h5-index+quartile,exclude,not_reviewed_at_this_stage,exclude,not_reviewed_at_this_stage,not_reviewed_at_this_stage,not_reviewed_at_this_stage,not_reviewed_at_this_stage,no,no,not_selected_for_taxonomy_mapping,no,journals
2429,2024,secure fully distributed event-triggered consensus of multi-agent systems against distributed sequential scaling attacks,w. he; s. li; x. ge; f. qian,ieee transactions on industrial informatics,ieee,23,114,23,Q1,h5-index+quartile,exclude,not_reviewed_at_this_stage,exclude,not_reviewed_at_this_stage,not_reviewed_at_this_stage,not_reviewed_at_this_stage,not_reviewed_at_this_stage,no,no,not_selected_for_taxonomy_mapping,no,journals
2430,2024,resilient fuzzy control synthesis of nonlinear dc microgrid via a time-constrained dos attack model,f. yang; s. hu; x. xie; d. yue; j. sun,ieee transactions on automation science and engineering,ieee,20,62,20,Q1,h5-index+quartile,exclude,not_reviewed_at_this_stage,exclude,not_reviewed_at_this_stage,not_reviewed_at_this_stage,not_reviewed_at_this_stage,not_reviewed_at_this_stage,no,no,not_selected_for_taxonomy_mapping,no,journals
2431,2022,deepclean: a robust deep learning technique for autonomous vehicle camera data privacy,o. adeboye; t. dargahi; m. babaie; m. saraee; c. -m. yu,ieee access,ieee,19,164,6.333333333333333,Q1,h5-index+quartile,exclude,not_reviewed_at_this_stage,exclude,not_reviewed_at_this_stage,not_reviewed_at_this_stage,not_reviewed_at_this_stage,not_reviewed_at_this_stage,no,no,not_selected_for_taxonomy_mapping,no,journals
2432,2024,formal-guided fuzz testing: targeting security assurance from specification to implementation for 5g and beyond,j. yang; s. arya; y. wang,ieee access,ieee,15,164,15,Q1,h5-index+quartile,exclude,not_reviewed_at_this_stage,exclude,not_reviewed_at_this_stage,not_reviewed_at_this_stage,not_reviewed_at_this_stage,not_reviewed_at_this_stage,no,no,not_selected_for_taxonomy_mapping,no,journals
2433,2024,secure attack detection framework for hierarchical 6g-enabled internet of vehicles,h. sedjelmaci; n. kaaniche; a. boudguiga; n. ansari,ieee transactions on vehicular technology,ieee,17,120,17,Q1,h5-index+quartile,exclude,not_reviewed_at_this_stage,exclude,not_reviewed_at_this_stage,not_reviewed_at_this_stage,not_reviewed_at_this_stage,not_reviewed_at_this_stage,no,no,not_selected_for_taxonomy_mapping,no,journals
2434,2022,device identification in blockchain-based internet of things,a. dorri; c. roulin; s. pal; s. baalbaki; r. jurdak; s. s. kanhere,ieee internet of things journal,ieee,20,122,6.666666666666667,Q1,h5-index+quartile,exclude,not_reviewed_at_this_stage,exclude,not_reviewed_at_this_stage,not_reviewed_at_this_stage,not_reviewed_at_this_stage,not_reviewed_at_this_stage,no,no,not_selected_for_taxonomy_mapping,no,journals
2435,2023,towards neural network-based communication system: attack and defense,z. xiong; z. cai; c. hu; d. takabi; w. li,ieee transactions on dependable and secure computing,ieee,18,59,9,Q1,h5-index+quartile,exclude,not_reviewed_at_this_stage,exclude,not_reviewed_at_this_stage,not_reviewed_at_this_stage,not_reviewed_at_this_stage,not_reviewed_at_this_stage,no,no,not_selected_for_taxonomy_mapping,no,journals
2436,2022,unified detection of attacks involving injection of false control commands and measurements in transmission systems of smart grids,s. chakrabarty; b. sikdar,ieee transactions on smart grid,ieee,11,130,3.666666666666667,Q1,h5-index+quartile,maybe_include,exclude,exclude,not_reviewed_at_this_stage,not_reviewed_at_this_stage,not_reviewed_at_this_stage,not_reviewed_at_this_stage,no,no,not_selected_for_taxonomy_mapping,no,journals
2437,2023,a survey on vehicular cloud network security,j. deng; j. deng; p. liu; h. wang; j. yan; d. pan; j. liu,ieee access,ieee,971,164,485.5,Q1,h5-index+quartile,exclude,not_reviewed_at_this_stage,exclude,not_reviewed_at_this_stage,not_reviewed_at_this_stage,not_reviewed_at_this_stage,not_reviewed_at_this_stage,no,no,not_selected_for_taxonomy_mapping,no,journals
2438,2024,the voiceprivacy 2022 challenge: progress and perspectives in voice anonymisation,m. panariello; n. tomashenko; x. wang; x. miao; p. champion; h. nourtel; m. todisco; n. evans; e. vincent; j. yamagishi,ieee/acm transactions on audio speech and language processing,ieee,11,,11,Q1,quartile,exclude,not_reviewed_at_this_stage,exclude,not_reviewed_at_this_stage,not_reviewed_at_this_stage,not_reviewed_at_this_stage,not_reviewed_at_this_stage,no,no,not_selected_for_taxonomy_mapping,no,journals
2441,2024,geo-perturbation for task allocation in 3-d mobile crowdsourcing: an a3c-based approach,m. min; h. zhu; s. yang; j. xu; j. tong; s. li; j. shu,ieee internet of things journal,ieee,7,122,7,Q1,h5-index+quartile,exclude,not_reviewed_at_this_stage,exclude,not_reviewed_at_this_stage,not_reviewed_at_this_stage,not_reviewed_at_this_stage,not_reviewed_at_this_stage,no,no,not_selected_for_taxonomy_mapping,no,journals
2443,2024,physical-layer identification of wireless iot nodes through puf-controlled transmitter spectral regrowth,q. zhou; y. he; k. yang; t. chi,ieee transactions on microwave theory and techniques,ieee,10,,10,Q1,quartile,exclude,not_reviewed_at_this_stage,exclude,not_reviewed_at_this_stage,not_reviewed_at_this_stage,not_reviewed_at_this_stage,not_reviewed_at_this_stage,no,no,not_selected_for_taxonomy_mapping,no,journals
2444,2024,robust distributed estimation of wireless sensor networks under adversarial attacks,c. -y. chen; d. tan; p. li; j. chen; g. gui; b. adebisi; h. gacanin; f. adachi,ieee transactions on vehicular technology,ieee,2,120,2,Q1,h5-index+quartile,maybe_include,exclude,exclude,not_reviewed_at_this_stage,not_reviewed_at_this_stage,not_reviewed_at_this_stage,not_reviewed_at_this_stage,no,no,not_selected_for_taxonomy_mapping,no,journals
