workbook_record_id,year,title,author_list,venue,engine,citation_count,h5_index,mean_citation,quartile,quality_signal_available,title_stage_decision,abstract_keyword_stage_decision,post_abstract_decision,quality_decision,survey_decision,nids_scope_decision,access_decision,selected_for_detailed_review,retained_for_taxonomy_mapping,taxonomy_mapping_status,included_in_final_primary_corpus,source_sheet
2977,2024,a survey on security of uav swarm networks: attacks and countermeasures,"wang, xiaojie and zhao, zhonghui and yi, ling and ning, zhaolong and guo, lei and yu, f. richard and guo, song",acm computing surveys,acm,5,94,5,Q1,h5-index+quartile,exclude,not_reviewed_at_this_stage,exclude,not_reviewed_at_this_stage,not_reviewed_at_this_stage,not_reviewed_at_this_stage,not_reviewed_at_this_stage,no,no,not_selected_for_taxonomy_mapping,no,journals
2979,2024,software security analysis in 2030 and beyond: a research roadmap,"b\""{o}hme, marcel and bodden, eric and bultan, tevfik and cadar, cristian and liu, yang and scanniello, giuseppe",acm transactions on software engineering and methodology,acm,2,24,2,Q1,h5-index+quartile,exclude,not_reviewed_at_this_stage,exclude,not_reviewed_at_this_stage,not_reviewed_at_this_stage,not_reviewed_at_this_stage,not_reviewed_at_this_stage,no,no,not_selected_for_taxonomy_mapping,no,journals
2980,2024,adapt: adaptive camouflage based deception orchestration for trapping advanced persistent threats,"putrevu, venkata sai charan and mukhopadhyay, subhasis and manna, subhajit and rani, nanda and vaid, ansh and chunduri, hrushikesh and putrevu, mohan anand and shukla, sandeep",digital threats: research and practice,acm,5,,5,Q1,quartile,exclude,not_reviewed_at_this_stage,exclude,not_reviewed_at_this_stage,not_reviewed_at_this_stage,not_reviewed_at_this_stage,not_reviewed_at_this_stage,no,no,not_selected_for_taxonomy_mapping,no,journals
2983,2023,gnn-based advanced feature integration for ics anomaly detection,"l(y)u, shuaiyi and wang, kai and wei, yuliang and liu, hongri and fan, qilin and wang, bailing",acm transactions on intelligent systems and technology,acm,2,40,1,Q1,h5-index+quartile,exclude,not_reviewed_at_this_stage,exclude,not_reviewed_at_this_stage,not_reviewed_at_this_stage,not_reviewed_at_this_stage,not_reviewed_at_this_stage,no,no,not_selected_for_taxonomy_mapping,no,journals
2986,2023,automated adversary-in-the-loop cyber-physical defense planning,"banik, sandeep and ramachandran, thiagarajan and bhattacharya, arnab and bopardikar, shaunak d.",acm transactions on cyber-physical systems,acm,5,19,2.5,Q1,h5-index+quartile,maybe_include,exclude,exclude,not_reviewed_at_this_stage,not_reviewed_at_this_stage,not_reviewed_at_this_stage,not_reviewed_at_this_stage,no,no,not_selected_for_taxonomy_mapping,no,journals
2987,2024,"multi-class imbalanced data handling with concept drift in fog computing: a taxonomy, review, and future directions","sharief, farhana and ijaz, humaira and shojafar, mohammad and naeem, muhammad asif",acm computing surveys,acm,5,94,5,Q1,h5-index+quartile,exclude,not_reviewed_at_this_stage,exclude,not_reviewed_at_this_stage,not_reviewed_at_this_stage,not_reviewed_at_this_stage,not_reviewed_at_this_stage,no,no,not_selected_for_taxonomy_mapping,no,journals
2991,2025,"towards robust cyber attack taxonomies: a survey with requirements, structures, and assessment","santos, paulo roberto da paz ferraz and resende, paulo angelo alves and gondim, jo\~{a}o jos\'{e} costa and drummond, andr\'{e} costa",acm computing surveys,acm,0,94,,Q1,h5-index+quartile,exclude,not_reviewed_at_this_stage,exclude,not_reviewed_at_this_stage,not_reviewed_at_this_stage,not_reviewed_at_this_stage,not_reviewed_at_this_stage,no,no,not_selected_for_taxonomy_mapping,no,journals
2993,2022,cybersecurity challenges in the offshore oil and gas industry: an industrial cyber-physical systems (icps) perspective,"mohammed, abubakar sadiq and reinecke, philipp and burnap, pete and rana, omer and anthi, eirini",acm transactions on cyber-physical systems,acm,41,19,13.66666666666667,Q1,h5-index+quartile,exclude,not_reviewed_at_this_stage,exclude,not_reviewed_at_this_stage,not_reviewed_at_this_stage,not_reviewed_at_this_stage,not_reviewed_at_this_stage,no,no,not_selected_for_taxonomy_mapping,no,journals
2996,2023,system auditing for real-time systems,"bansal, ayoosh and kandikuppa, anant and hasan, monowar and chen, chien-ying and bates, adam and mohan, sibin",acm transactions on privacy and security,acm,9,,4.5,Q1,quartile,exclude,not_reviewed_at_this_stage,exclude,not_reviewed_at_this_stage,not_reviewed_at_this_stage,not_reviewed_at_this_stage,not_reviewed_at_this_stage,no,no,not_selected_for_taxonomy_mapping,no,journals
2997,2022,examining penetration tester behavior in the collegiate penetration testing competition,"meyers, benjamin s. and almassari, sultan fahad and keller, brandon n. and meneely, andrew",acm transactions on software engineering and methodology,acm,9,24,3,Q1,h5-index+quartile,exclude,not_reviewed_at_this_stage,exclude,not_reviewed_at_this_stage,not_reviewed_at_this_stage,not_reviewed_at_this_stage,not_reviewed_at_this_stage,no,no,not_selected_for_taxonomy_mapping,no,journals
3000,2025,cyber-physical artificial intelligence: systematic research domain for integrating artificial intelligence and cyber-physical systems,"lee, sanghoon and chae, jiyeong and jeon, haewon and kim, taehyun and hong, yeong-gi and um, doo-sik and kim, taewoo and park, kyung-joon",acm transactions on cyber-physical systems,acm,0,19,,Q1,h5-index+quartile,exclude,not_reviewed_at_this_stage,exclude,not_reviewed_at_this_stage,not_reviewed_at_this_stage,not_reviewed_at_this_stage,not_reviewed_at_this_stage,no,no,not_selected_for_taxonomy_mapping,no,journals
3006,2023,threat-based simulation of data exfiltration toward mitigating multiple ransomware extortions,"mundt, michael and baier, harald",digital threats: research and practice,acm,19,,9.5,Q1,quartile,exclude,not_reviewed_at_this_stage,exclude,not_reviewed_at_this_stage,not_reviewed_at_this_stage,not_reviewed_at_this_stage,not_reviewed_at_this_stage,no,no,not_selected_for_taxonomy_mapping,no,journals
3014,2024,towards attack detection in multimodal cyber-physical systems with sticky hdp-hmm based time series analysis,"hong, andrew e. and malinovsky, peter p. and damodaran, suresh k.",digital threats: research and practice,acm,5,,5,Q1,quartile,exclude,not_reviewed_at_this_stage,exclude,not_reviewed_at_this_stage,not_reviewed_at_this_stage,not_reviewed_at_this_stage,not_reviewed_at_this_stage,no,no,not_selected_for_taxonomy_mapping,no,journals
3022,2024,multi-spacephish: extending the evasion-space of adversarial attacks against phishing website detectors using machine learning,"yuan, ying and apruzzese, giovanni and conti, mauro",digital threats: research and practice,acm,7,,7,Q1,quartile,exclude,not_reviewed_at_this_stage,exclude,not_reviewed_at_this_stage,not_reviewed_at_this_stage,not_reviewed_at_this_stage,not_reviewed_at_this_stage,no,no,not_selected_for_taxonomy_mapping,no,journals
3024,2024,deep learning for time series anomaly detection: a survey,"zamanzadeh darban, zahra and webb, geoffrey i. and pan, shirui and aggarwal, charu and salehi, mahsa",acm computing surveys,acm,161,94,161,Q1,h5-index+quartile,exclude,not_reviewed_at_this_stage,exclude,not_reviewed_at_this_stage,not_reviewed_at_this_stage,not_reviewed_at_this_stage,not_reviewed_at_this_stage,no,no,not_selected_for_taxonomy_mapping,no,journals
3025,2023,rare category analysis for complex data: a review,"zhou, dawei and he, jingrui",acm computing surveys,acm,3,94,1.5,Q1,h5-index+quartile,exclude,not_reviewed_at_this_stage,exclude,not_reviewed_at_this_stage,not_reviewed_at_this_stage,not_reviewed_at_this_stage,not_reviewed_at_this_stage,no,no,not_selected_for_taxonomy_mapping,no,journals
3030,2022,threats to training: a survey of poisoning attacks and defenses on machine learning systems,"wang, zhibo and ma, jingjing and wang, xue and hu, jiahui and qin, zhan and ren, kui",acm computing surveys,acm,73,94,24.333333333333329,Q1,h5-index+quartile,maybe_include,exclude,exclude,not_reviewed_at_this_stage,not_reviewed_at_this_stage,not_reviewed_at_this_stage,not_reviewed_at_this_stage,no,no,not_selected_for_taxonomy_mapping,no,journals
3035,2024,a survey on resilience in information sharing on networks: taxonomy and applied techniques,"batista, agnaldo de souza and dos santos, aldri luiz",acm computing surveys,acm,1,94,1,Q1,h5-index+quartile,exclude,not_reviewed_at_this_stage,exclude,not_reviewed_at_this_stage,not_reviewed_at_this_stage,not_reviewed_at_this_stage,not_reviewed_at_this_stage,no,no,not_selected_for_taxonomy_mapping,no,journals
3037,2024,a combinatorial optimization analysis method for detecting malicious industrial internet attack behaviors,"zhao, kejing and zhang, zhiyong and raymond choo, kim-kwang and zhang, zhongya and zhang, tiantian",acm transactions on cyber-physical systems,acm,2,19,2,Q1,h5-index+quartile,exclude,not_reviewed_at_this_stage,exclude,not_reviewed_at_this_stage,not_reviewed_at_this_stage,not_reviewed_at_this_stage,not_reviewed_at_this_stage,no,no,not_selected_for_taxonomy_mapping,no,journals
3038,2023,blockchain-based federated learning for securing internet of things: a comprehensive survey,"issa, wael and moustafa, nour and turnbull, benjamin and sohrabi, nasrin and tari, zahir",acm computing surveys,acm,238,94,119,Q1,h5-index+quartile,exclude,not_reviewed_at_this_stage,exclude,not_reviewed_at_this_stage,not_reviewed_at_this_stage,not_reviewed_at_this_stage,not_reviewed_at_this_stage,no,no,not_selected_for_taxonomy_mapping,no,journals
3039,2022,"a security review in the uavnet era: threats, countermeasures, and gap analysis","rugo, alessio and ardagna, claudio a. and ioini, nabil el",acm computing surveys,acm,79,94,26.333333333333329,Q1,h5-index+quartile,exclude,not_reviewed_at_this_stage,exclude,not_reviewed_at_this_stage,not_reviewed_at_this_stage,not_reviewed_at_this_stage,not_reviewed_at_this_stage,no,no,not_selected_for_taxonomy_mapping,no,journals
3043,2023,implementing data exfiltration defense in situ: a survey of countermeasures and human involvement,"chung, mu-huan and yang, yuhong and wang, lu and cento, greg and jerath, khilan and raman, abhay and lie, david and chignell, mark h.",acm computing surveys,acm,18,94,9,Q1,h5-index+quartile,exclude,not_reviewed_at_this_stage,exclude,not_reviewed_at_this_stage,not_reviewed_at_this_stage,not_reviewed_at_this_stage,not_reviewed_at_this_stage,no,no,not_selected_for_taxonomy_mapping,no,journals
3052,2023,know thy ransomware response: a detailed framework for devising effective ransomware response strategies,"bajpai, pranshu and enbody, richard",digital threats: research and practice,acm,14,,7,Q1,quartile,exclude,not_reviewed_at_this_stage,exclude,not_reviewed_at_this_stage,not_reviewed_at_this_stage,not_reviewed_at_this_stage,not_reviewed_at_this_stage,no,no,not_selected_for_taxonomy_mapping,no,journals
3053,2022,randomized error removal for online spread estimation in high-speed networks,"wang, haibo and ma, chaoyi and odegbile, olufemi o. and chen, shigang and peir, jih-kwon",ieee/acm transactions on networking,acm,7,65,2.333333333333333,Q1,h5-index+quartile,exclude,not_reviewed_at_this_stage,exclude,not_reviewed_at_this_stage,not_reviewed_at_this_stage,not_reviewed_at_this_stage,not_reviewed_at_this_stage,no,no,not_selected_for_taxonomy_mapping,no,journals
3058,2023,resilience-by-design in adaptive multi-agent traffic control systems,"al mallah, ranwa and halabi, talal and farooq, bilal",acm transactions on privacy and security,acm,2,,1,Q1,quartile,exclude,not_reviewed_at_this_stage,exclude,not_reviewed_at_this_stage,not_reviewed_at_this_stage,not_reviewed_at_this_stage,not_reviewed_at_this_stage,no,no,not_selected_for_taxonomy_mapping,no,journals
3060,2025,toward trustworthy artificial intelligence (tai) in the context of explainability and robustness,"chander, bhanu and john, chinju and warrier, lekha and gopalakrishnan, kumaravelan",acm computing surveys,acm,29,94,inf,Q1,h5-index+quartile,exclude,not_reviewed_at_this_stage,exclude,not_reviewed_at_this_stage,not_reviewed_at_this_stage,not_reviewed_at_this_stage,not_reviewed_at_this_stage,no,no,not_selected_for_taxonomy_mapping,no,journals
3061,2024,"a survey on cyber resilience: key strategies, research challenges, and future directions","alhidaifi, saleh mohamed and asghar, muhammad rizwan and ansari, imran shafique",acm computing surveys,acm,29,94,29,Q1,h5-index+quartile,exclude,not_reviewed_at_this_stage,exclude,not_reviewed_at_this_stage,not_reviewed_at_this_stage,not_reviewed_at_this_stage,not_reviewed_at_this_stage,no,no,not_selected_for_taxonomy_mapping,no,journals
3062,2023,understanding indicators of compromise against cyber-attacks in industrial control systems: a security perspective,"asiri, mohammed and saxena, neetesh and gjomemo, rigel and burnap, pete",acm transactions on cyber-physical systems,acm,44,19,22,Q1,h5-index+quartile,exclude,not_reviewed_at_this_stage,exclude,not_reviewed_at_this_stage,not_reviewed_at_this_stage,not_reviewed_at_this_stage,not_reviewed_at_this_stage,no,no,not_selected_for_taxonomy_mapping,no,journals
3069,2023,algorithmic complexity attacks on dynamic learned indexes,"yang, rui and kornaropoulos, evgenios m. and cheng, yue",proceedings of the vldb endowment,acm,1,,0.5,Q1,quartile,exclude,not_reviewed_at_this_stage,exclude,not_reviewed_at_this_stage,not_reviewed_at_this_stage,not_reviewed_at_this_stage,not_reviewed_at_this_stage,no,no,not_selected_for_taxonomy_mapping,no,journals
3070,2022,towards an advanced deep learning for the internet of behaviors: application to connected vehicles,"mezair, tinhinane and djenouri, youcef and belhadi, asma and srivastava, gautam and lin, jerry chun-wei",acm transactions on sensor networks,acm,28,23,9.3333333333333339,Q1,h5-index+quartile,exclude,not_reviewed_at_this_stage,exclude,not_reviewed_at_this_stage,not_reviewed_at_this_stage,not_reviewed_at_this_stage,not_reviewed_at_this_stage,no,no,not_selected_for_taxonomy_mapping,no,journals
3082,2024,"resilient machine learning: advancement, barriers, and opportunities in the nuclear industry","khadka, anita and sthapit, saurav and epiphaniou, gregory and maple, carsten",acm computing surveys,acm,4,94,4,Q1,h5-index+quartile,exclude,not_reviewed_at_this_stage,exclude,not_reviewed_at_this_stage,not_reviewed_at_this_stage,not_reviewed_at_this_stage,not_reviewed_at_this_stage,no,no,not_selected_for_taxonomy_mapping,no,journals
3097,2024,"security and reliability of internet of underwater things: architecture, challenges, and opportunities","jiang, bin and feng, jiacheng and cui, xuerong and wang, jian and liu, yongxin and song, houbing",acm computing surveys,acm,5,94,5,Q1,h5-index+quartile,exclude,not_reviewed_at_this_stage,exclude,not_reviewed_at_this_stage,not_reviewed_at_this_stage,not_reviewed_at_this_stage,not_reviewed_at_this_stage,no,no,not_selected_for_taxonomy_mapping,no,journals
3099,2024,"industrial internet of things ecosystems security and digital forensics: achievements, open challenges, and future directions","kebande, victor r. and awad, ali ismail",acm computing surveys,acm,27,94,27,Q1,h5-index+quartile,exclude,not_reviewed_at_this_stage,exclude,not_reviewed_at_this_stage,not_reviewed_at_this_stage,not_reviewed_at_this_stage,not_reviewed_at_this_stage,no,no,not_selected_for_taxonomy_mapping,no,journals
3101,2023,a survey on explainable anomaly detection,"li, zhong and zhu, yuxuan and van leeuwen, matthijs",acm transactions on knowledge discovery from data,acm,114,32,57,Q1,h5-index+quartile,exclude,not_reviewed_at_this_stage,exclude,not_reviewed_at_this_stage,not_reviewed_at_this_stage,not_reviewed_at_this_stage,not_reviewed_at_this_stage,no,no,not_selected_for_taxonomy_mapping,no,journals
3102,2024,combining cyber security intelligence to refine automotive cyber threats,"sommer, florian and gierl, mona and kriesten, reiner and kargl, frank and sax, eric",acm transactions on privacy and security,acm,11,,11,Q1,quartile,exclude,not_reviewed_at_this_stage,exclude,not_reviewed_at_this_stage,not_reviewed_at_this_stage,not_reviewed_at_this_stage,not_reviewed_at_this_stage,no,no,not_selected_for_taxonomy_mapping,no,journals
3105,2023,gotta catch âem all: a multistage framework for honeypot fingerprinting,"srinivasa, shreyas and pedersen, jens myrup and vasilomanolakis, emmanouil",digital threats: research and practice,acm,18,,9,Q1,quartile,exclude,not_reviewed_at_this_stage,exclude,not_reviewed_at_this_stage,not_reviewed_at_this_stage,not_reviewed_at_this_stage,not_reviewed_at_this_stage,no,no,not_selected_for_taxonomy_mapping,no,journals
3112,2025,"wi-fi sensing techniques for human activity recognition: brief survey, potential challenges, and research directions","miao, fucheng and huang, youxiang and lu, zhiyi and ohtsuki, tomoaki and gui, guan and sari, hikmet",acm computing surveys,acm,4,94,inf,Q1,h5-index+quartile,exclude,not_reviewed_at_this_stage,exclude,not_reviewed_at_this_stage,not_reviewed_at_this_stage,not_reviewed_at_this_stage,not_reviewed_at_this_stage,no,no,not_selected_for_taxonomy_mapping,no,journals
3114,2022,constraint enforcement on decision trees: a survey,"nanfack, g\'{e}raldin and temple, paul and fr\'{e}nay, beno\^{\i}t",acm computing surveys,acm,45,94,15,Q1,h5-index+quartile,exclude,not_reviewed_at_this_stage,exclude,not_reviewed_at_this_stage,not_reviewed_at_this_stage,not_reviewed_at_this_stage,not_reviewed_at_this_stage,no,no,not_selected_for_taxonomy_mapping,no,journals
3115,2023,building dynamic system call sandbox with partial order analysis,"zhang, quan and zhou, chijin and xu, yiwen and yin, zijing and wang, mingzhe and su, zhuo and sun, chengnian and jiang, yu and sun, jiaguang",proceedings of the acm on programming languages,acm,5,,2.5,Q1,quartile,exclude,not_reviewed_at_this_stage,exclude,not_reviewed_at_this_stage,not_reviewed_at_this_stage,not_reviewed_at_this_stage,not_reviewed_at_this_stage,no,no,not_selected_for_taxonomy_mapping,no,journals
3116,2023,meter: a dynamic concept adaptation framework for online anomaly detection,"zhu, jiaqi and cai, shaofeng and deng, fang and ooi, beng chin and zhang, wenqiao",proceedings of the vldb endowment,acm,10,,5,Q1,quartile,exclude,not_reviewed_at_this_stage,exclude,not_reviewed_at_this_stage,not_reviewed_at_this_stage,not_reviewed_at_this_stage,not_reviewed_at_this_stage,no,no,not_selected_for_taxonomy_mapping,no,journals
3121,2024,mouse dynamics behavioral biometrics: a survey,"khan, simon and devlen, charles and manno, michael and hou, daqing",acm computing surveys,acm,23,94,23,Q1,h5-index+quartile,exclude,not_reviewed_at_this_stage,exclude,not_reviewed_at_this_stage,not_reviewed_at_this_stage,not_reviewed_at_this_stage,not_reviewed_at_this_stage,no,no,not_selected_for_taxonomy_mapping,no,journals
3125,2022,cybersecurity of industrial cyber-physical systems: a review,"kayan, hakan and nunes, matthew and rana, omer and burnap, pete and perera, charith",acm computing surveys,acm,197,94,65.666666666666671,Q1,h5-index+quartile,exclude,not_reviewed_at_this_stage,exclude,not_reviewed_at_this_stage,not_reviewed_at_this_stage,not_reviewed_at_this_stage,not_reviewed_at_this_stage,no,no,not_selected_for_taxonomy_mapping,no,journals
3127,2023,general-purpose unsupervised cyber anomaly detection via non-negative tensor factorization,"eren, maksim e. and moore, juston s. and skau, erik and moore, elisabeth and bhattarai, manish and chennupati, gopinath and alexandrov, boian s.",digital threats: research and practice,acm,13,,6.5,Q1,quartile,exclude,not_reviewed_at_this_stage,exclude,not_reviewed_at_this_stage,not_reviewed_at_this_stage,not_reviewed_at_this_stage,not_reviewed_at_this_stage,no,no,not_selected_for_taxonomy_mapping,no,journals
3131,2024,a machine learning and optimization framework for efficient alert management in a cybersecurity operations center,"ghadermazi, jalal and shah, ankit and jajodia, sushil",digital threats: research and practice,acm,5,,5,Q1,quartile,exclude,not_reviewed_at_this_stage,exclude,not_reviewed_at_this_stage,not_reviewed_at_this_stage,not_reviewed_at_this_stage,not_reviewed_at_this_stage,no,no,not_selected_for_taxonomy_mapping,no,journals
3144,2024,when sdn meets low-rate threats: a survey of attacks and countermeasures in programmable networks,"tang, dan and dai, rui and yan, yudong and li, keqin and liang, wei and qin, zheng",acm computing surveys,acm,2,94,2,Q1,h5-index+quartile,exclude,not_reviewed_at_this_stage,exclude,not_reviewed_at_this_stage,not_reviewed_at_this_stage,not_reviewed_at_this_stage,not_reviewed_at_this_stage,no,no,not_selected_for_taxonomy_mapping,no,journals
3145,2023,digital twin-based anomaly detection with curriculum learning in cyber-physical systems,"xu, qinghua and ali, shaukat and yue, tao",acm transactions on software engineering and methodology,acm,35,24,17.5,Q1,h5-index+quartile,exclude,not_reviewed_at_this_stage,exclude,not_reviewed_at_this_stage,not_reviewed_at_this_stage,not_reviewed_at_this_stage,not_reviewed_at_this_stage,no,no,not_selected_for_taxonomy_mapping,no,journals
3147,2025,recent advances of differential privacy in centralized deep learning: a systematic survey,"demelius, lea and kern, roman and tr\""{u}gler, andreas",acm computing surveys,acm,10,94,inf,Q1,h5-index+quartile,exclude,not_reviewed_at_this_stage,exclude,not_reviewed_at_this_stage,not_reviewed_at_this_stage,not_reviewed_at_this_stage,not_reviewed_at_this_stage,no,no,not_selected_for_taxonomy_mapping,no,journals
3148,2023,hiper - early detection of a ransomware attack using hardware performance counters,"anand, p. mohan and charan, p. v. sai and shukla, sandeep k.",digital threats: research and practice,acm,15,,7.5,Q1,quartile,exclude,not_reviewed_at_this_stage,exclude,not_reviewed_at_this_stage,not_reviewed_at_this_stage,not_reviewed_at_this_stage,not_reviewed_at_this_stage,no,no,not_selected_for_taxonomy_mapping,no,journals
3150,2024,anomaly detection in dynamic graphs: a comprehensive survey,"ekle, ocheme anthony and eberle, william",acm transactions on knowledge discovery from data,acm,8,32,8,Q1,h5-index+quartile,exclude,not_reviewed_at_this_stage,exclude,not_reviewed_at_this_stage,not_reviewed_at_this_stage,not_reviewed_at_this_stage,not_reviewed_at_this_stage,no,no,not_selected_for_taxonomy_mapping,no,journals
3154,2024,accurate localization in los/nlos channel coexistence scenarios based on heterogeneous knowledge graph inference,"zhang, bojun and liu, xiulong and xie, xin and tong, xinyu and jia, yungang and shi, tuo and qu, wenyu",acm transactions on sensor networks,acm,1,23,1,Q1,h5-index+quartile,exclude,not_reviewed_at_this_stage,exclude,not_reviewed_at_this_stage,not_reviewed_at_this_stage,not_reviewed_at_this_stage,not_reviewed_at_this_stage,no,no,not_selected_for_taxonomy_mapping,no,journals
3157,2023,graph neural networks in iot: a survey,"dong, guimin and tang, mingyue and wang, zhiyuan and gao, jiechao and guo, sikun and cai, lihua and gutierrez, robert and campbel, bradford and barnes, laura e. and boukhechba, mehdi",acm transactions on sensor networks,acm,144,23,72,Q1,h5-index+quartile,exclude,not_reviewed_at_this_stage,exclude,not_reviewed_at_this_stage,not_reviewed_at_this_stage,not_reviewed_at_this_stage,not_reviewed_at_this_stage,no,no,not_selected_for_taxonomy_mapping,no,journals
3158,2025,unsupervised outlier detection with reinforced noise discriminator,"zhang, zhongping and liu, daoheng and zhu, jinwei and wu, youxi",acm transactions on intelligent systems and technology,acm,0,40,,Q1,h5-index+quartile,exclude,not_reviewed_at_this_stage,exclude,not_reviewed_at_this_stage,not_reviewed_at_this_stage,not_reviewed_at_this_stage,not_reviewed_at_this_stage,no,no,not_selected_for_taxonomy_mapping,no,journals
3164,2025,a.i. robustness: a human-centered perspective on technological challenges and opportunities,"tocchetti, andrea and corti, lorenzo and balayn, agathe and yurrita, mireia and lippmann, philip and brambilla, marco and yang, jie",acm computing surveys,acm,27,94,inf,Q1,h5-index+quartile,exclude,not_reviewed_at_this_stage,exclude,not_reviewed_at_this_stage,not_reviewed_at_this_stage,not_reviewed_at_this_stage,not_reviewed_at_this_stage,no,no,not_selected_for_taxonomy_mapping,no,journals
3168,2022,emerging cybersecurity capability gaps in the industrial internet of things: overview and research agenda,"axon, louise and fletcher, katherine and scott, arianna schuler and stolz, marcel and hannigan, robert and kaafarani, ali el and goldsmith, michael and creese, sadie",digital threats: research and practice,acm,12,,4,Q1,quartile,exclude,not_reviewed_at_this_stage,exclude,not_reviewed_at_this_stage,not_reviewed_at_this_stage,not_reviewed_at_this_stage,not_reviewed_at_this_stage,no,no,not_selected_for_taxonomy_mapping,no,journals
3170,2023,a comprehensive review of the state-of-the-art on security and privacy issues in healthcare,"l\'{o}pez mart\'{\i}nez, antonio and gil p\'{e}rez, manuel and ruiz-mart\'{\i}nez, antonio",acm computing surveys,acm,93,94,46.5,Q1,h5-index+quartile,exclude,not_reviewed_at_this_stage,exclude,not_reviewed_at_this_stage,not_reviewed_at_this_stage,not_reviewed_at_this_stage,not_reviewed_at_this_stage,no,no,not_selected_for_taxonomy_mapping,no,journals
3172,2024,libby-novick beta-liouville distribution for enhanced anomaly detection in proportional data,"sghaier, oussama and amayri, manar and bouguila, nizar",acm transactions on intelligent systems and technology,acm,2,40,2,Q1,h5-index+quartile,exclude,not_reviewed_at_this_stage,exclude,not_reviewed_at_this_stage,not_reviewed_at_this_stage,not_reviewed_at_this_stage,not_reviewed_at_this_stage,no,no,not_selected_for_taxonomy_mapping,no,journals
